poiID;title;text;
21;A must visit place for Delhi Trip;It is the largest museum in India and is considered as the hub of Indian art, culture and history. It has over 200,000 exhibits including sculptures, manuscripts, paintings, and other artifacts that date back to the Indus Valley Civilization.
21;Pathetic museum, nothing really to see.;Not worth visiting the place. Ome of the worst museum I've ever visited. Presumably, the British stole everything and they have nothing to display. It has a bunch of clay bows, coins and plenty of statutes of, I guess, their deities in all forms and out of all kinds of materials.<br>There were only a couple of visitors besides me.
21;Relics from an ancient civilisation;Set up in 1949, this National Museum houses over 2 million artefacts from the ancient civilisation. On display are the Relics of the Buddha (5th to 4th BCE), unearthed in Uttar Pradesh. Outstanding specimens of Buddhist Art, illustrated through almost 100 exhibits in stone, bronze, terracotta, stucco and painted scrolls. The artefacts represent Buddhist arts of Nepal, Tibet, Central Asia, Myanmar, Java and Cambodia. Many of these relics stimulate a sense of devotion, dedication and love for humanity. <br><br>I am eternally blessed to have personally seen the beautiful Buddhist Art in New Delhi. I remain deeply humbled by the teachings of Gautama Buddha. <br>
21;Must Visit Place;It has a huge collection of sculptors, coins, paintings, etc right from Indus Valley Civilization to modern history of India nicely distributed among different galleries. For someone who is interested in the history and culture of India, this is a must visit place. At least 3 - 4 hours are required to go through all the sections.
21;Maybe it's interest dependent, but frankly I found the curation quite lacking;I've been to a few museums around the world, Rijksmuseum in the Netherlands being my favorite so far. The National Museum of Delhi was on my list for some time and spent a Saturday here with a friend, its quite covid safe and fairly empty. So was, in my humble opinion, the heart in it.<br><br>Why this Museum needs an overhaul 1:<br><br>I love museums because they put you in the middle of a world, it can be imaginative, inspiring. The National museum of Delhi felt like it was me in a lot of rooms, rummaging through artefacts.<br><br>Excavations of pots, pillars, sculptures since 5000 BC arranged as a disconnected set of artefacts across about 12 departments.<br><br>Why this Museum needs an overhaul 2:<br><br>We are thriving in the 21st century between technology and connectivity. The biggest Museum in Delhi deserves a good medium for audio guides - they immensely compliment the experience and are barely any expense or effort to provide consistently. If you do it like I did - you might end up toggling Youtube and the HopOn India App QR codes which are sporadically placed and usually unrelated to each other.<br><br>I wish I could contribute in some way to improve India's biggest Museum
21;largest museum;Situated on Janpath, includes varieties of arts and crafts, you can find 2 lakhs objects both indian and foreign
22;Such a shame no one can be bothered to maintain the history;Well, given it’s so cheap at least you could argue that it’s value for money… there’s a tiny little train that goes round for about 5 minutes, you’re not allowed to look in any of the locomotives they have there, and those they do are in complete disrepair. The museum is minimal and none of the interactive features work. The diesel simulator is good fun, except for some guy coming in and repeatedly telling the children how they should be driving it properly and thus sucking all the fun out of the experience. <br>The most shocking part is the ‘exhibit’ of the royal train…pictures attached. I’ll let you make your own judgement.
22;Good place for kids;Overall good place for kids to gain knowlage. Toy train is there for fun. Neet and clean washroom. Large area for explore. Out side food allow in museum. Canteen available but food is not ok. We ordered fried rice with manchurian and paneer dosa both were below quality. Rice was uncooked, lots of oil in dosa. My suggestion keep your food with self or eat from out side
22;Noice!;You always feel like a child when visiting a Museum.<br>The museum is well kept with hundred of exhibits inside the museum building and dozens of railway coaches, engines and other rail related equipment on display.<br>You can buy tickets for toy train, joy train and a diesel engine simulator.<br>You can easily cover the museum in 3 hours.
22;On track for an interesting time.;THIS quirky site has quite a bit going on from a museum and loads of trains and rolling stock to a chance to rattle round on a little track yourself.<br>Don't make the mistake I did which was to pay for my 50 rupee (55 pence) entry ticket and walk all the way inside only to find that I needed a separate ticket for the little "Joy Train". I had to walk all the way back, get a 20 rupee ticket for that and then walk back again to the trains.<br>There are any number of locomotives and carriages to look at as well as unusual things such as special vans to carry animals such as sheep,<br>I'd happily come to the museum by tuk tuk which is so easy to do once you've calmed your nerves about going through Delhi traffic.<br>Wandering about I found the first locomotive to be built in India and station clocks made in London as well as a turntable area.<br>Inside the museum there were some incredible early black and white photographs of trains in action and a display of dozens and dozens of railway plates and badges.<br>Maps showing visitors the site, what they can see and where it is were very handy because the area to explore is a long oblong and stretches away a lot further than you'd think.<br>There is a souvenir shop which could do with a wider range of things to buy, a cafe, toilets, water points, an archive and an auditorium in what is a very well run site.<br>I happily spent a couple of hours there and would definitely recommend anyone in Delhi to pay this museum a visit.
22;A must visit for Rail Enthusiast;National Rail Musuem, New Delhi<br><br>A must visit for Rail enthusiast and for kids who want to explore the history of Railways. Located at Chanakyapuri are, besides the Embassy of Bhutan, there is ample parking space. Entry fee is Rs 50 from M-F and Rs 100 on Sat-Sun.<br>Souvenir shop was below expectations and there was hardly anything which one would like to buy. Rail Musuem covers the History of Railways from beginning to British India and present .<br>Exhibits in the premises are well maintained and informative
22;Wonderful Place for Kids;Parking place is available outside the premises. Ticket rates are high on Weekends and National Holidays.
22;Always a great place!;Due to COVID, the crowd is moderately less. It ain't so less that you feel scared being alone but neither crowded. The train rides are the charmers. <br><br>It was the second visit of my six year old (last was when he was 4). This time he had ofcourse a lot more fun and was able to put his experience into writing after coming back. He also drew engine after coming back. He was excited to see rail tracks and engines. I did not go into much teaching mode or making him learn any names of train. <br><br>While my 19 month old was just happy to run around. We took him in the pram and during the end of our visit made him walk. <br><br>Don't miss the indoor display on first floor. <br><br>Can bring own food and enjoy a relaxing picnic with family. <br><br>2.5 hrs is good enough time to spend there. One can also head to Khan market post rail museum for better dining experience.
22;Rail transport;Located in Chanakyapuri , it includes exhibits of the history of the rail of India right from British era
22;CHUK CHUK RAILGARI;National Rail museum is located at Chankayapuri in New Delhi.It is a unique museum and has collection of over 100 real size exhibits of Indian railways.The museum is spread across 11 acres of land.A toy train run around its sites.
22;The Best Rail Museum;I had to Nagpur’s Narrow Gauge Rail Museum, which is also good in its capacity. However, this one in Delhi being in National capital is the biggest. Though it has everything one should required to know, but the entry ticket is on a very higher side. Two different types of ticketing systems. On weekdays for adult it is Rs.50/- whereas on weekends and Holidays it is Rs.100/-.For child upto 10 yrs it is Rs.10/- and Rs.20/- respectively. But for one of its kind experience, don’t be regret for paying this, especially if you have child/children. Toy Train Rides(two different types) one inside the train other on top of the train to digital quizzes about railway and a vast information about the railways surely give you joy and improve your knowledge.
23;One of the oldest observatory sites;A nice observatory monument in Delhi and one of the oldest observatory sites ever created. It is relatively well maintained for the most part (although some of the older bits looked a bit more worn out) and it consists of 13 architectural observatory instruments in the site and the surrounding gardens in the area were beautiful and well maintained.
23;Unique and memorable;What a cool discovery in an unexpected place. Worth a visit and almost free (I think 300 R to enter). The park doesn’t seem to get very busy so it’s a nice place to walk around and look at all of the different pieces, relax and sit on a bench for a few minutes. <br>Unlike anything else I’ve seen!
23;Jantar Mantar Delhi is one of the Five built in India;Jantar Mantar of Delhi was built by Maharaja Jay Singh II of Jaipur way back in 1724. Maharaja Jay Singh-II had a lot of interest in astronomy and astrology,  He was good Mathematician, town planner and a very good ruler as well. He had mastered four languages: Arabic, Greek, Persian and Sanskrit. There are total 5 Jantar Mantar's in North India at Mathura, Ujjain, Varanasi, Delhi and Jaipur which were completed between 1724 to 1737. The Delhi Jantar Mantar is the one which was constructed First compare to other four of India. Second one is Varanasi, Third Mathura, Fourth Ujjain and the fifth one is Jaipur. Jaipur one was constructed at the last and in a vast area. All instruments in Jaipur Jantar Mantar are still in working condition and remaining four including Delhi are incomplete constructions and not in working condition. All these four were built for trail and but finalized in Jaipur.<br><br>The main purpose of building the observatory was to collect astronomical tables and to make accurate estimates of the motions of the planets, the Moon and the Sun. Jantar Mantar is a huge complex to learn about space and time. Jantar Mantar is actually Sanskrit work, Jantar means Machine/Instrument  and Mantra means formula/Calculation. overall meaning of Jantar Mantar is "Machine that calculate". Delhi Jantar Mantar consists of 13 architectural instruments. But among these the most noticeable ones are<br><br>Mishra Yantra which is resembling the formation of a Spade, this heart shaped structure is symbolic of Delhi. It was used to figure out noon in different cities across the world.<br><br>Samrat Yantra is the famous giant triangular sundial that raises to a height of 70 feet. It is an instrument that measures time accurately.<br><br>Jayaprakash Yantra is one of the most captivating instrument. This is actually a hollow hemisphere which reflects every point in the Sky.<br><br>Ram Yantra which measures altitude of Stars, this structure consists of two cylindrical buildings containing radial lines that spread out from a center.<br><br>Patel Chowk and Rajeev Chowk are nearest Railway stations to reach Delhi Jantar Mantar.<br>Timings:<br>Morning 06:00 to Evening 06:00<br><br>Entry Fee:<br>25 INR for Indian's and 300 INR for Foreigners.
23;Jantar mantar;Great place. A lot of scientific information. Must visit with children. The place is very relaxing with lots of trees around.
23;Great instruments of astronomy;Jantar Mantar is located in Connaught place. “Jantar Mantar” literally means “instruments for measuring the harmony of the heavens”. It consists of 13 architectural astronomy instruments. The Ram Yantra, the Samrat Yantra, the Jai Prakash Yantra and the Misra Yantra are the distinct instruments of Jantar Mantar. Entry free is 15 to 20 Rs.
23;a nice place for a stroll before most sights are open;I was up early and no where to go, so decided to stroll through the astronomical devices. The guard was helpful. I knew nothing when I arrived and learned a few things too. Enjoy!
23;Astronomy;Saw this back in December and forgot to write a review until now. These are 18th century astronomical instruments primarily for compiling the times and movements of the sun, moon and planets, and for predicting their future movements. These ones in Delhi were also built by the Rajput ruler Jai Singh II and are very similar to the Jantar Mantar in Jaipur, also built by the same dude. The difference between these and the ones in Jaipur are that these are terracotta coloured. The Jantar Mantar here is bigger but less well maintained than the ones in Jaipur. If I hadn’t already seen the ones in Jaipur, I would’ve given this a higher score. The entrance price is also quite steep if you’re a foreigner just to see astronomical instruments that no longer function.
23;Not maintained;With an entry fee of Rs.25/- for adult, this is now popular for Dharna place rather than a monument.People also come here and use this as a park. But no doubt, it also has many fine structures to see.But almost all the instruments build in cemented platform are detoriating,   lost its color and shine. But whatever remains are good and useful.
23;Indian astronomical building/s a few 100 years old;Jantar Mantar is another iconic New Delhi building that every Indian has seen a picture of in their school textbooks. It was constructed a few 100 years ago by the Maharaja of Jaipur to make accurate astronomical calculations. The main building is a sundial and it is quite accurate. The different buildings comprise of different "yantras" to calculate time, seasons, astronomical events etc. There is a lot of maths /measurementsinvolved and visiting with a knowledgeable guide would make your visit much more rewarding.Even without a guide, we enjoyed our visit.
23;Sundial;Jantar Mantar was built by Maharaja Jai singh of Jaipur in 1723. Purpose of observatory is to predict the times and  movements of the sun.<br><br>4 instruments inside the observatory are - samrat yantra, jayaprakash, Rama yantra, misra yantra.<br><br>During 1727 to 1734 Maharaja Jai Singh of jaipur had built total 5 such observatory named jantar mantar across north india, others are at - jaipur, ujjain, mathura, varanasi.
24;Found Easy Parking;I always go to Nizamuddin railway station to pick up my relatives and, every time, I get stuck in the parking area. But last time, I went to the same place a couple of days back and found a new parking service which was so quick and easy to excess the parking slot by their app named PARK+.
24;Satellite Station of Delhi;One of the main Railway Stations in Delhi, this is not very far from New Delhi Railway Station and many important trains start and terminate at this station. The station has all the major facilities and there is a large display board at the entrance (PF 1) to give you information about the trains. The station is clean and PF 1 has escalators also. Construction work is going on at some platforms so slight inconvenience while boarding and de-boarding trains on those platforms. Hope it will improve in future.
24;Nizamuddin Railway Station -Worst , Poor and High rate parking(Nizamuddin side) .;Nizamuddin Railway Station -Worst , Poor and High rate parking(Nizamuddin side) fully dark without any light. High charges 0-6 hours 100 Rs, there is no 1 hour slot as maximum people useing to dropping their relative/parents.<br>Similar situation in  Sarai Kale Khan side, Road are captured by unauthorized vendor/encroach, The real situation on Capital railway station.
24;Major station in Delhi;Nizamuddin Railway Station is one of the major railway stations of Delhi, but located in the south of the city. There’s an upper class waiting hall with several eateries on the same section. The station is pretty straightforward to navigate and is set up like most major stations in India. The facilities here are not as good the other major stations in Delhi, but I do like it because it’s well connected by metro.
24;Railway journey;It's quite well developed. If u hv been here 5 yrs before u will be amazed at the upgradation. Its become more friendly.
24;Determination and a plan;The front desk called us an Ola (India has Uber, but Ola is like the home-grown version of Uber and also widely used).  A tiny box of a car turned up with no boot/trunk so the two big bags had to go in the front passenger seat next to the bags and the two small bags and us were jammed in the back. 700 odd metres to the train station, anywhere else in the world, with wheely luggage would be nothing (OK - anywhere but Asia) but between overpasses, no footpaths, traffic, heat and sun - the $1.80 in the taxi was worth it.  Strictly speaking 85 rupees... but not one person in this nation has change, even for tiny notes. But we were prepared this time and had the front desk man at the hotel change a 100 rupee note for us (A$2) - so we only paid out 90 rupees in 10 rupee notes.  Heaven forbid we encourage a false economy and overpay at every forced ‘opportunity’ to do so.  <br><br>We got to the station and were immediately set upon by porters. But if we can pack these bags, we can carry them. Not so much we don’t want to pay the porters - we just don’t trust them as far as we can throw them as they are horrendously rough with luggage and insist on whipping out the wheeling handle at the slightest chance and endeavouring to break it off.  So lug the bags we did. Got to the right platform, found a helpful, person. She had her phone out and told us which end of the  platform to be on, 6 carriages behind the engine.  Nothering worse than being at the wrong end of a very very long train. Fortunately it was the originating station for our express to Rajasthan, so it pulled in about 9.30 am and we had plenty of time to follow it a short distance, get on our carriage and wow!<br><br>All and all a good experience, however, we find you must have plan on how you are going to negotiate the chaos.
24;Nice and clean station;Platform no. 1 of this station has lifts and escalator is also there on platform no. 1 which is on nizamuddin dargah side. Platform 6 also has an escalator.
24;Busy station need s traffic management;A number of trains start from here, but the entry point is almost always choked with vehicles. A better traffic management system is required. Also station needs lot of investment to become trendy like New Delhi Railway station, as it is one of the important railway stations of the Capital city.
24;Good place from starting journey;hazrat nizamuddin railway station is one of the biggest station in india. when i was traveling surat to leh that time i was booked my train tickets surat to hazrat nizamuddin. one of the busiest railway station in india. hazrat nizamuddin railway station is well maintained. you can easily travel any place from this station. you can start your journey from here.
24;Extremely busy railway station;Hazrat Nizamuddin railway station in Delhi is one of the main railway station serving the residents of Delhi and it's nearby areas like Noida and Ghaziabad. Named after the famous Sufi Saint Nizamuddin Auliya it is as famous as the other two stations New Delhi and Old Delhi. The station code is NZM.<br><br>It was built to take away some load from the overcrowded New Delhi railway station but it looks now that this station itself has become overcrowded. More than 50 trains originate and terminate here which makes it quite a busy station. In comparison to the other two stations, it is smaller in size but remains busy throughout the day.<br><br>There are two entry points to the station. The entry through Sarai Kale Khan is the more busy one and thus see's most of the traffic. Entry points remain jam packed being really small with hardly space for a single car to move on. Parking is a huge pain point throughout the year with taxis and autos occupying most of the space.<br><br>Facility wise there is not much in comparison to others. Though there has been some improvement in terms of passenger facilities like food stalls, train information system and general cleanliness. But a lot need to be done to give a comforting experience to the passengers.<br><br>Overall a nice station for people residing in South/East Delhi and nearby areas. Easy to reach using multiple modes of transport. Some improvement required in passenger facilities which will make it a standard railway station at par with the other two.
25;respect for the father of the nation;a simple, decent, courtyard, and the black marble marking the place where Ganhi was cremated<br>just a few trees, each one planted by former left side political personalities<br>a wonderful voice could be heard, low and discreet, fulfilling the air - those sounds, identified thanks to shazam, will accompany us during the whole trip in India<br>deep emotion
25;Great Trip Experience Of Rajghat;The garden is very beautiful and Mahatma Gandhi cremation place in Delhi. I have expected to see some information about the history of the Mahatma Gandhi . It is a place to reflect on his life and contributions of the creation of the independence of India . I particularly like the carved with some of his saying, which rings so true. It is the humbling place to visit the grounds and the monument area are simple,  peaceful and beautiful.
25;A GREAT MAN VENERATED;Raj Ghat is a memorial  to Mahatma Gandhi. Originally it was the name of a historic ghat in old Delhi<br><br>This is a calm and tranquil area dedicated to the memory of Mahatma Gandhi. It is where Gandhi was cremated following his assassination in January 1948<br><br>In the centre of the lawned and landscaped area, under an internal flame, is a black marble platform marking the site of the cremation.<br><br>Other Ghats in the same area remembered other Indian greats, Indira Gandhi (3rd Prime Minister of India, her son Rajiv Gandhi (6th Prime Minister of India (both these were assassinated) and Jawaharial Nauru (1st Prime Minister of India, and others. <br><br>Quite a moving spot and very important to Indians
25;The place where Gandhi was cremated after his assassination.;This is a memorial place dedicated to the memory of Gandhi. An eternal flame burns beside a cenotaph. There are well kept gardens in the area, and there are many flowers. The entrance is free, but there is security to pass through. Many schoolchildren visit here to help them learn about Gandhi. Definitely worth a visit, but not a place to spend a lot of time unless you wish to sit and ponder the life of Gandhi.
25;Calm, relaxing, Gandhi;The Raj Ghat is not a big fancy attraction, for instance, as the Taj Mahal. It's a quiet place of calm and humility, very symbolic of how Gandhi lived. This is where his remains are and people come to pay their respects to essentially the father of the nation. It's a large compound of grass, bush and few trees all very well-kept. It's mostly empty compared to other places you can visit in Delhi, and security is constant. As you walk to the center, there are inscriptions of Gandhi's sayings on the walls of the pavement and in the middle is the main square where the tomb is. This main zone has to be crossed barefoot (with socks) and I don't think there's shoe covers available (at least when we went there). Still, this place is very much worth the visit, specially if you want a place to relax and get away from the chaos that is Delhi.
25;A simple well maintain memorial;Though it is a large memorial, it is a very simple memorial. A wall encircles  a grassy field with a rectangular marker in the middle. You need to remove your shoes before entering and you can't carry your shoes unless in a backpack or such.
25;Calm and Peaceful;There is a black marble platform which marks the final resting place of Mahatma Gandhi and there is an eternal flame. The area is very clean and well maintained, lots of greenery around.
25;Isabelle (France);The Raj Ghat is the final resting place of the Mahatma Gandhi, who is one of the most respected Indian rulers, one of the most respected rulers of all times.<br>At the entrance of the Raj Ghat, we had to take off our shoes<br>We walked on a paved path in a peaceful garden to go to the beautiful monument of black marble, bearing the inscription "He Ram". These words mean "O my God", and have been told by the Mahatma Gandhi before his last breath.<br>Behind the monument, we saw a perpetual flame burning, which represents the eternity of the Mahatma Gandhi.<br>I highly recommend to visit the Raj Ghat!!! I found that is a haven of peace, simplicity and serenity, represents perfectly the spirit of this great peace-loving man.
25;A restful place to go;Mother and Daughter holiday Feb 2020<br>We packed a lot in to our first day in Delhi, probably too much but it would have felt wrong to have not come here. Was a short time of tranquility in and felt appropriate to feel the ground with my feet within the memorial area.
25;Mahatma Ghandi memorial;My tour group visited this memorial as part of our India tour in January 2020.  The memorial has detailed photos and stories about Ghandi's life and activism.  I also saw where Ghandi slept and where his body was laid out after his killing.
