poiID;title;text;
27;Most disabled-unfriendly museum I have ever visited;What really interests me about Hungary is that their language is not slavic like those in neighbouring countries. It is more related to Finnish or Sami.<br>I have a slipped disc and use sticks to walk. It is painful to stand for too long and stairs are very painful. I could not have picked a worse place to visit.<br>The entry is via a flight of 30 steps to the front door. To leave your coat in the cloakroom you then have to descend a spiral set of stairs. I asked if there was a lift. The answer was it was only for staff. I was led there by a member of staff up a small flight of steps and then down another flight.<br>I then had to go up in the lift again to get to the archaeological exhibition, which was up a flight of steps! In the exhibition, there was no space to sit, which meant standing to a long time to read the boards.<br>After an hour of discomfort, I was unable to see any other sections of the museum and left.<br>Although the EU has laws about disabled access, it does not seem to have reached Hungary yet.
27;Nice little hour passed;Worth a visit and a lot to see. Variety of things to see so was interesting throughout and to see the history of Hungary and learn a bit more about the country. Decent price also to get in was around £5 each. We walked here took around 17min not sure how easy it is to get to in transport.
27;Horrible cold place.;Awful. Terribly signed posted inside and terrible for children. <br><br>Cold and rude staff, constantly snapping at my three year old for even going close to the glass cabinets. Constant dirty looks as we entered the room from staff. Wouldn’t step foot in there again. Such a shame as the exhibitions were interesting.
27;Shocking appalling;Shocking experience. We didn’t see any exhibitions. We got sold a student ticket that’s only valid for Hungarian and eu people, even after he asked where we are from and I said that we are English he still sold me the ticket even though it’s not valid. The guards didn’t let us even enter any rooms before kicking us out as our ticket wasn’t valid for us “english” people. Very discriminatory. Also walked in with many bags and was then told to leave the room as we have bags. Very weird experience and just left out of disgust.. never returning and don’t go if you are english! Clearly a Hungarian only musuem. Rude staff
27;Incredible museum;I have been to many museums but this one really struck me as special. The exhibits were very explanatory and the artifacts were in incredible condition. Highly recommend
27;Interesting but not very welcoming;The museum itself contains a wealth of interesting objects and displays, including but not limited to - a piano played by both Beethoven and Liszt, the glasses and prison cell door of Imre Nagy and a reconstruction of Janos Kadar's office.<br><br>However, some of the museum staff were rather rude and unhelpful and the museum itself isn't very well laid out. <br><br>Also, you have to purchase a special photo ticket in order to take any photos, but you aren't actually informed of this when buying your ticket. Fortunately for me, only a guard about halfway through our time in the museum actually cared to enforce this so we were able to take photos up until then.
28;Ironic balance of monuments;Very interesting square with a wide variety of memorials and monuments. Surprised to see a statue of Presidents Bush and Reagan across from one dedicated to Soviet Soldiers. Then down the way is another dedicated to the Holocaust. It was a pretty park with a blend of monuments which all had a different angle to history.
28;Nice area;Nice and large park area close to The Danube and Parliament Building. Lots of benches to sit and enjoy the day. Surrounded by some beautiful buildings. Lots of renovation with going on currently in this area.
28;It will soon turn into the 2nd Memento Park.;It is deeply symbolic that the first known building on the current Freedom Square was at the end of the XVIII century a prison in which captured officers of the French Revolutionary Army were held. For this reason, the building was named the Hungarian Bastille. After the revolution took place in Hungary in 1848-1849, fighters for independence were held here. Lajos Battiani, the first prime minister of Hungary, was executed here. This building has not been preserved. The beautiful mansions around the perimeter of the square belong to the Secession era (the Austrian name for Art Deco). The Palace of the Stock Exchange and the National Bank of Hungary was designed by Alpar Ignac, the architect of the Vaidahunyad Castle. The beautiful square was disfigured under the Horthy dictatorship. A bunch of different sculptures with pompous and exalted names were installed on it: Hungarian Resurrection or Hungarian Pain. The only surviving statue belongs to the American general-occupier of the Philippines Bandholtz, who prevented the Romanians from robbing the Hungarian museum in 1919. Residents of Baghdad are probably surprised here that there were American generals in history who did not rob museums, but prevented it... After the Communists came to power in 1945, the statue of the stocky general was dragged to the American embassy, which it pleased with its modest artistic merits until the end of the 80s. It was dragged back to the square in 1989 for the arrival of President George Bush. Not the one who thought Slovakia and Slovenia were the same country, but his dad Bush Sr. The Elder Bush himself stands in stone here. The authorities of the capital added a third American to it - Ronald Reagan in 2011. To his centenary. As I understand it, we should expect lovelace Clinton, Nobel Prize winner Obama and Trump and Biden.. The current government is not as friendly with the Americans as the previous ones, so in 2019 they inaugurated a monument to the victims of the German invasion. The monument is accused of suppressing Hungary's role in World War II and genocide. All the arguments against are located next to the monument. The dominant feature of the square is an obelisk to the soldiers of the Red Army who died during the capture of Budapest. The assault cost the Red Army dearly and initially there was a mass grave here, which was later moved. This is the only Soviet monument in Budapest that was not moved to the Memento Park. However, judging by the dynamics of the placement of large and small (Tiny Hidden Statues are still there) monuments, nothing will need to be moved. There will be no fewer monuments here...
28;Full of Historical Monuments;This park is just a short walk from the Parliament Buildings and offers much to see. There are many monuments, memorials, and statues in this small area that commemorate both the good and the bad of Hungarian and European history. <br><br>In this area you will see two American Presidents, and a General who played an important part in Hungary’s history.
28;Chock Full of Budapest History;If you love being outside or love historical monuments, this is your place. "Freedom Square" (as some locals call it) is a great place to hang out and experience what the locals do for outdoor entertainment. You will likely find a "flea market" type of vibe, with many local artisans selling their handmade wares. The historical significance is impressive. Just a few steps from each other, you will find monuments dedicated to the Soviets and two American Presidents, Ronald Reagan and George Bush. Be sure and allocate some time to visit here. You will not be disappointed.
28;Square;Beautiful square close to the Parlament. Statues of US presidents and Soviet troops in it. Great spot to take a walk, sit down and enjoy the weather
28;Square with memorials.;We walked through this square, park area, on the way to parliament. There are memorials to holocaust victims and lots of grassed areas. There is a coffee shop in the centre and plenty of restaurants close by. A nice area.
28;This square touched my heart;Szabadsag Ter ("Liberty Square") is one of Budapes't most genteel and inviting public space. The first person you'll see as you enter the square is the statue of Mr. Ronald Reagan. He is respected in Hungary for his role as a Cold Warrior. It's fun to watch the steady stream of passerby, both Hungarians and tourists, do a double-take, chuckle, then snap a photo with the Gipper. <br><br>Next - walk around the stout obelisk to the center of the square. This is the Soviet War Memorial, commemorating "Liberation Day" : April 4,1945, when the Soviets officially forced the Nazis out of Hungary. <br><br>What's else we can see in this leafy huge square? The Square ringed by both sides by fancy old apartments blocks (typical of high-class townhouses from Budapest's Golden Age  in the late 1800s) and important buildings such as the former Hungarian State Television headquarters, the US Embassy, and the National Bank of Hungary. <br><br>But the most memorable part of this park is the monument to the Hungarian victims of the Nazis. This is a rather large area covered with variable pop-up fountains, where adults and children enjoy life and nice weather getting joy of the water and  take pictures. Behind the fountains is an obelisk with a proud eagle and photographs of the victims of the Nazis. This is a very touching place. It's nice to just sit here keeping silence and respect.
28;Fun and sadness;Lovely park with memorials. Couldn't help but notice that while children played in the dancing fountains, feet away, holocaust familes paid respect to those who they lost in WW2 with a beautiful and poignant memorial to their loved ones.
28;a small square where the conflict and contratdiction of the past century is spelled out in stone and statuary;We see monuments and statues lauding the Red Army for defeating the Germans (even though the Hungarians supported the Nazis for most of the war) , ultimately honoring Ronald Reagan for doing and saying the things that truly liberated Hungary. Lot of geopolitical statements made here and it is a fascinating and provocative place. Close to the center of things in Pest and between the Parliament Building at the Basilica it is well worth a short visit.
28;Square with various monuments;This is a small grassy square not far from the Danube, but still a ltitle off the tourist track and so perfect for a sit down to pass the time and explore the dfifferent monuments and features which depict various stages of Hungarian history. At ist heart is a large fountain which will appeal to families and there are plemty of cafes nearby.
28;Huge park and square, with anchoring monuments.;Large park, with two memorable monuments at each end: Monument to Soviet Red Army and Memorial for Victims of German Occupation.
29;Opportunity Lost to Expand Understanding of Jewish History in Europe;Without a doubt, this is one of the most spectacular examples of synagogue architecture in Europe. And the museum collection is amazing. However, at 9000 HUF (about USD 27) per person, the experience is out of reach of many and dissuades those who might not be specifically interested but open to learn about this important history. It is true that the synagogue is generally crowded but he crowds are older and not representative of the new generations of people, many of whom know little or nothing about the Holocaust. The entire experience left a bit of a bad taste in my mouth.
30;Didn’t stay;Underwhelming area, visited to attend Christmas market as recommended. Greeted on arrival by a man exposing himself and urinating in the middle of the street. Graffiti everywhere, didn’t stay!
30;Pretty suburb of Budapest;Just a few train stops on the outside of Budapest , i found this charming suburb, a quaint atmosphere, it has many beautiful buildings a museum and Christmas markets one of five best in Budapest recommended to me.<br>It is on the same suburban train line as Szentendre and tickets are free to Obuda with the Budapest 7 day travel ticket.<br>Aquincum is close by with Roman ruins.
30;hidden tressure of budapest;this is a area if you are in Budapest and want to og away from tourist area i will recommend highly<br>its many hidden beautiful buildings<br>funny statues of woman With umbrella<br>beautiful old square With a pink Palace hidden away into a gate<br>Zichy Palace<br>a beautiful nonnery yellow colour same as Church<br>and Nice house museum gyula krudy<br>and we finished With fantastic Food at a restaurant beside Church<br>this was a wonderful visit to obuda<br>this is a hidden diamant of an area of Budapest<br>i loved it
30;Spend sometime just wondering around here;Visited on Sunday 8th October. We were on a guided tour and our tour guide took us for a walk around this very historic area of the city. Not to be missed, just make sure you allow yourself enough time to see everything there.
30;Too much for a day.;After reading the reviews, your feeling is, that only the Roman Amphitheater is worth seeing in Óbuda. But Óbuda offers a lot of interesting and beautiful sights. Let's start with the Memorial of the Katyn Martyrs, which is just a few steps away from the Amphitheater and the tram stops right in front of it. <br>The majority of the attractions are in and around the Main Square (Fő tér) and the Holy Spirit Square ( Szentlélek tér).My advice to go by HEV5 to Szent Lélek Square station, and from there just walk. Of course, buses are going in the same direction. I just preferred the HEV from Batthyany Square station. When you get off maybe the first thing is the Peter and Paul's Catholic Church on Lajos Street, and also there is an impressive Synagogue as well. Continue your walk to Kalvin köz, where is the oldest Reformed Church of Budapest. On Main Square, there are two famous sculptures, The Waiters an Imre Varga sculpture and Szindbáb, a figure from a well known Krudy novel. Walking around this area, you find plenty of interesting museums, for example, the Victor Vasarely Museum, the Varga Imre Collection, the (Roman) Baths Museum and many more. Also, there is the Florian Square with Roman ruins, and many cozy little restaurants, where you can enjoy not only the meals but also the pleasant surroundings. My favorite is the Zöldkapu restaurant, and another is the Új Sipos Halászkert. There're so many things to see and enjoy, that one day isn't enough. You have to go back again, and again.
31;Great museum with a range of displays;Came here for a Bosch exhibition, and was not disappointed. In addition to the Bosch displays, there was a wonderful range of art work from a range of timeframes to enjoy. A must visit when in Budapest.
31;Great collection;If you are into paintings this is the place to be! Such a beatiful collection. We spend about 2.5 hours in the museum but could not see it all. The collection is nicely organized by style/country and period. Dont miss out on the great pieces by Cranach and Rafael.
31;Beautiful;Beautiful Egyptian and Greek collection underground in a beautiful building. The museum is beautifully arranged. There is a free cloakroom. Unfortunately, I didn't have the energy to see the rest of the museum but it seems to me that it would have been worth it. Overall, great experience. Free with the Budapest card.
31;very interesting;the building itself is very impressive. The collection is very interesting and worth a visit. the facilites are also excellent with a very clean and organised cloakroom and toilets. The bar and restaurant are very clearly marked for allergies and quality of food is excellent.
31;For art sake!;The museum is located adjacent to the Heroes Square and is a grand structure in its own right. We didn't have time to enjoy the exhibitions, but the building itself is a work of art.
31;RUDE STAFF;Men at entrance  VERY RUDE.  NO access to  Cafe or washrooms after spending over 100EUROs in the shop. Not helpful or even  polite.
31;My favorite art place in Budapest 🇭🇺;The Museum of Fine Arts Budapest is Hungary's largest and finest art museum. Its collection includes thousands of artwork from prehistory to the present. Old master paintings (13th to 18th centuries) was my favorite containing over 3000 paintings in the collection. If you enjoy art and paintings, make sure you allocate 3-5 hours to this museum. Felt that the Fine Arts Museum was above the Hungarian National Gallery in terms of display of art, more organized and the visit was more structured. This museum was my number 1 most enjoyed experience in Budapest. Entry price: 11EUR
31;Bosch exhibition;One of our main goals of visiting Budapest was the Bosch exhibition. It was an extra, that we could watch all exhibitions with the Bosch ticket, so we took the chance. It's a great building with lots to see, we seen hours here. Even the building itself worths a visit. There are many artifacts here from different eras of history. If someone likes arts they should certainly spend some time here.
31;Rude staff which do not speak English. Silly security rules.;The staff are all elderly and none speak English! Whether you bought a ticket online for a specific time is irrelevant to them, you have to queue anyway. If you have a bag it needs to be searched. After searching, it still needs to be deposited in the cloakroom. What is the point of that? If you get too close to the paintings, the staff give you a rude telling off in Hungarian, despite there being no signs stating in English how close you can get to the paintings.
31;Nice Visit;It’s a very good Art Museum - not great. If you like religious themes, you’ll love it as that seems to be the emphasis. We went for the Bosch exhibit which was also very good - not great. We walked here from the city center in about an hour. Kind of confusing to track rooms you’ve visited, but after a while, the art seemed all the same to me. Next to Heroes Plaza added to trip worthiness.
31;A first class art museum;A first class art museum. Great orientation for guests from abroad. Beautiful premises. The Bosch temporary exhibition was fabulous, with precious art and good documentation. The permanent collection has a few highlights that should not be missed. The panel describing these in the entry hall is worth consulting. As an advice - book tickets in advance to avoid the lines.
31;Badly Organised;Bought a ticket line for the Permanent Collection and had to wait 1 hour outside in the sun.<br>What’s the point of buying a ticket in advance when people who arrive after you without a ticket get in before you.<br>Once inside the art is fabulous, hardly anyone inside…they’re all queuing outside.<br>You should have 2 lines one for people with Hieronymus Bosch Tickets and one for people who have tickets for the permanent collection.<br>Won’t return.
32;Beautiful Neo-Gothic architecture;This icon of Budapest and Hungary lives up to all expectations. The outside stone had so much detail and the grand scale of the building was impressive. The inside is incredibly ornate.
32;Costly entrance fee;We purchased the tickets online directly from the official Parliament site. When I tried to prebook the audio guide for English tour , it was always not available however I discovered that if you look around 8am on the day you want to visit it is likely you will be able to get a ticket. <br>The building itself is beautiful however the tour is only 45 minute long and you have to go through security to take the tour. <br>It was quite costly for a 45 minute tour, I most probably wouldn’t recommend it as it was not value for money. It cost around £25:00 per person.
32;One of the most beautifully ornate buildings anywhere!;This is probably the most recognizable building of Budapest’s endless catalogue of amazing architecture. I did not go inside but walked around it several times. I did hear a tour guide noting that the building was too big and too expensive but it sure is a fascinating collection of various architectural styles! It is absolutely worth visiting. However, note that the best views of the building are not AT the building but rather across the river or on the Elizabeth Bridge.
32;An imposing building in the centre of Budapest;The building is an imposing landscape that every tourist should visit in Budapest. It’s luxury is outstanding and you should go there to take many pictures. In the night, it is lighted and it is even more beautiful landscape!!!
32;Tours must be booked online;Touring the Hungarian Parliament Building was at the top of my to-do list during a visit to Budapest in early March 2023. Booked an early morning 8:30 am tour. An audio guide is included in the ticket price. It was fascinating to learn about the history of the building and Budapest. It is truly architecturally stunning.<br><br>Tours must be booked online. Time slots for tours during peak hours fill up fast so it is a good idea to plan ahead. Make time to tour the Hungarian Parliament Building when visiting beautiful Budapest.
32;Great opportunity to visit working seat of government!;Learned a great deal about Hungary's historical and current political structure.  Building is simply amazing.  At 45 minutes, the tour is an appropriate length of time to impart knowledge and generate interest in learning more, all without inundating tourists with details they'd never retain.<br>We couldn't book online (all tours sold out), but showed up on the day of and were able to get a ticket.  Go early if you expect to get a ticket.  We arrived at 9 am and got a ticket for the 3:30 tour time slot.  This was in the middle of shoulder season.  Advise to reserve well in advance for peak season travel.
32;Spectacular;This would have to be one of the most beautiful buildings in the world, especially when seen from th Danube at night. Spectacular. Tried to visit during the day but totally booked out!
32;Gorgeous;This architect was gorgeous, it is a must visit, next to the River, glows like a piece of gold at night, amazing walk during day and night.
32;A definite stop;The tour was well worth it-and it's best to book in advance. we were there at the end of March and by 10am they had posted a sign that all tickets for the day were sold out.<br>And in addition to the tour, there are two additional sites just outside the building. one addresses how things were built, and the other is quiet poignant, as it details the 1956 rebellion.
32;Parliament;One place that you must visit in Budapest is their historic parliamentary building. The tour guide named levy was wickedly funny and entertaining…i enjoyed this tour 👍👌
32;Must do when visiting Budapest. Book early;We thought we were not going to be able to visit the Parliament as available slots got booked up weeks in advance. Fortunately I discovered that they had released some more slots in the morning of the day we wanted to visit and I booked. The building is obviously the most famous landmark in Budapest and is as interesting inside as out. You even get to visit the Hungarian crown jewels. Visit takes about 45 minutes but that does include getting through security. One other strange thing was that they won't let you in with an eticket on your phone. You are told to exchange it for a paper version. No idea why!
32;Beautiful Building;Very informative tour, although felt we could have benefited from a smaller group as sometimes it was difficult to hear guide if you were at the back.   Guide very knowledgeable.
33;Take the stairs up to the tower!;Visited St. Stephen's Basilica (Szent István Bazilika) on a chilly, cloudy day in early March 2023. Really magnificent to see! The office for a tower ticket is across the street from the church next to Starbucks. There is an elevator to the observation tower but taking the stairs up to it is rewarding. Great panoramic views of Budapest.
33;Beautiful Church and Interesting Relic;OK, it is really annoying that the tickets are formulated in a conniving way to push people to pay more. The tickets are either for the cupola view OR the sanctuary - or a combination ticket for both. It would have been less tacky to offer a sanctuary ticket and an up-charge for the treasure and tower. We skipped the tower and treasury because the most fascinating bit is the relic of the hand of St. Stephen which is in the sanctuary on the right side. The church is enormous and serene and has the most amazing art. The whole paying to go into churches is new since the last time I toured Europe but I guess that's what keeps them up. It is worth paying for this one.
33;Well worth the visit;This is a beautiful place or was 20 yr ago so many tourists now you can hardly move but a must visit place.the building and architecture are amazing and definitely a must visit in this gorgeous city
33;Great views inside and out;I don’t know why I thought this was a free attraction, I read some reviews saying this but no one got in the door without purchasing a ticket first from the office across the street. Worth it though, i audibly gasped several times, beautiful inside. it’s the most Catholic place I ever went. I went for the cheap ticket then changed my mind when the card reader faltered, glad I did because I wanted to do the balloon fly thing to see out across the city but as others mentioned its always shut - except for the one time I was at the top of St Stephens Basilica of course, then I could see it flying in the distance :D.
33;Spectacular interior;You buy tickets from an office across the street. Either a ticket for the interior or one for the treasury and panorama. <br>Only took the interior ticket. The Interior is spectacular. Well worth the visit
33;Charge to enter a church;The entrance fee for this church was just unaffordable for a family. Jesus would not be amused that his house is being used to make money.
