poiID;title;text;
7;Great visit.;We walked all along the Red Fort at New Delhi. We took lots of photographs. There was such a lot to see in New Delhi. We had a great day the weather was superb and the history of the Red Fort was amazing.
7;Historical monument;It a beautiful monument with historical relevance। The muesum run by Dalmia group is truly excellent, it is a must visit for all
7;A ghost of Mughal history;After building the Taj Mahal in Agra, Mughal Emperor Shahjahan decided to move the imperial capital to Delhi. Here, beginning in the 1640s, he built the Red Fort and the Jama Masjid, the Red Fort to act as a shining example of Mughal architecture at its peak. The fort enclosed many palaces and gardens, housed several thousand people (including many slaves and minions, besides hundreds of members of the royal family), and was the epicentre of life in the city. After 1857, the British occupied the fort, and wreaked havoc. Today, only about 15% of the original Mughal buildings remain. the rest is all mostly British construction.<br><br>But what is there is worth seeing, from the Naubat Khaana/Naqqar Khaana, Halls of Public and Private Audience (Diwan-e-Aam and Diwan-e-Khaas respectively) to the palaces—Rang Mahal, Mumtaz Mahal, Khaas Mahal—to the four museums that are part of the fort. There are several eateries inside (all very basic), toilets (not very clean) and plenty of pleasant pathways through manicured gardens. <br><br>The entrance to the fort is through the Lahore Gate (facing Chandni Chowk), but through some odd and illogical twist, you aren’t allowed to get to Lahore Gate from this point. Instead, you have to go to the Delhi Gate of the Fort (about a kilometre to the side, near the Sunehri Masjid): fortunately, e-ricks are available, which charge you about Rs 10 per person for the ride. At the Delhi Gate of the Fort is the ticket counter. buy your tickets (children below 15 years go free) and then walk, along the outer wall of the fort next to the moat, to the Lahore Gate. After your visit to the Fort is over, you can exit the complex from near the Lahori Gate itself. you don’t need to walk all the way back to Delhi Gate/Sunheri Masjid.<br><br>Note: If you’re coming on the Delhi Metro, getting off at the Jama Masjid metro station is advisable: it’s closer to the Delhi Gate of the Fort.
7;SHEER SIZE AND ARCHITECTURE IS STUNNING;One of the sites of a stay in Delhi.<br><br>This massive fort, commissioned in the mid 1600’s ,is a feature of Delhi and was the palace of the Mogul Emperors .<br><br>Typical of Indian palaces/forts it comprises dining and eating areas of the emperors, huge external walls, large internal spaces once used for gardens etc.<br><br>Can be crowded at times, but the sheer size of the fort still provides for an easy stroll through the palace<br><br>Although striking from a distance, for some treason our tour of two was simply a Photo Stop and not an nactual visit. In this we were very disappointed
7;Largest monument in Delhi;This was the new Mughal headquarters that Emperor Shah Jahan built in 1638, when he abandoned Agra. A massive red-sandstone structure, it was surrounded by a deep moat, fed by the Yamuna River. After the decline of the Mughal Empire, the Persian Nadir Shah ransacked the fort, running off with all treasures, including the invaluable Peacock Throne.<br>Both the Delhi and the Lahori Gate are impressive and worth a separate visit.
7;Trip to redfort;Actually name is red fort and it's really wonerfull red one palace we had great time..thanks to tripadvisor
7;Average;This fort is over rated with a cost of 950 rupees to get in. The best part was the museum that hi-lighted portions of Indian history and was interesting to understand. The rest of the grounds hosed a few more buildings but nothing like some of the other forts in India.<br>Being one of the main attractions in Deli I am sure most Tourists will visit it but not as good as rated.
7;Very interesting place, you can easily spend half a day here;This is a place interesting to visitors focusing on Islamic era Indian history. There is a lot here to see - almost overwhelming unless you have a guide or read before coming. 17th century Mughal seat of power. Accessible via two gates. Entrance fee.
7;A sprawling fort complex with shops, museums, and palaces from the time of the Mughals.;The Red Fort of Delhi is a very large fort in Old Delhi. It can be entered from the Lahore Gate and there are shops on the entranceway in. The palaces are preserved, but have clearly been looted over the centuries. For those with an interest in history, the museum of the First War of Independence is worth checking also. Definitely worth a visit if in Delhi.
7;Original Fort was in white color;Red fort which is also famous as Lal Quila is spread across 255 acres in Old Delhi city and become one of the land mark location of the city. Nearest Metro station to Red fort is Chandni chowk station. There are two gates to enter inside one is called as Delhi gate and another one is called as Lahori gate. Delhi Gate is located on the southern wall of the Red fort and Lahori Gate is located on the Western wall.<br> Red fort is recognized as a UNESCO world heritage Site in the year 2007. Red fort was the residence of Mughal emperors for 200 years and after that it was taken over by the Britishers. Bahadur Shah Zafar was the last Mughal Emperor who was coronated here in the year 1837. <br><br>Architecture:<br>Shah Jahan decided to shift capital of Mughal Empire from Agra to Delhi by the side of River Yamuna. Architect Ustad Ahmad Lahauri was then assigned the task of building the Red fort. Architecture is made in Mughal and Indo-Islamic style. Red fort construction was started on 12th May 1638 and completed on 16th April 1648. It was Emperor Shah Jahan who built Red Fort. Red fort was actually white in color  That time it was known as the Quila-E-Mubarak which meant the blessed fort. when it was built by Shah Jahan, Originally made with Lime stone and eventually started chipping off. The British Government then had the entire monument painted red, this changing its original color forever and also name changed as Red Fort.<br>A satellite view of this fort reveals an octagonal shape.<br><br>Tourist Attractions in side fort:<br>Though there are many structures in the fort were either destroyed or badly damaged, the red fort still houses many historic places. They are<br>1. Mumtaz Mahal:<br>2. Khas Mahal<br>3. Rang Mahal<br>4. HIra Mahal<br>5. Moti Masjid<br>6. Hammam<br>7. Diwan e Aam<br>8. Naubat Khana<br>9. Diwan e Khas<br>10. Hayat Bajsh Bagh<br>11. Mehrab Bagh<br><br>Light Show:<br>Since year 1996 there is light show arranged inside the Red fort. Light show timings are varied season to season. But one can check the timing before visiting. It is always suggestable to plan your visit in the Evening and after visiting the fort you can witness light show which is one of the must visit attraction of Red fort. Entry ticket is 60 INR per adult, 20 INR per child on Weekdays and 80 INR per adult, 30 INR per child on weekends. <br><br>Time to cover Red fort:<br>The minimum time that one needs to see Lala Kila is around 2 hours and it may go up to 3 to 4 hours if you are planning to explore thoroughly.<br><br>Timings:<br>Morning 09:30 to Evening 04:30 all weekdays except on Monday.<br><br>Entry ticket:<br>50 INR per Indian Adults<br>600 INR per Foreigners
7;Old Delhi area visit;Good place to visit in winter time. Very near to Chandi chowk where you can do lots of shopping.really nice place
8;Salimgarh Fort;This fort has quite it's fare share of history related to INA and Netaji and is a must visit place for history buffs. Though it doesn't get as much footfall as Red Fort.
8;Club with the Red Fort, don't spend more than 20 minutes here;The Salimgarh Fort in Delhi predates its much more famous neighbour, the Red Fort and can only be accessed through a path leading from the latter. These forts, once separated by a branch of the River Yamuna, have this job being done by the Ring Road in present times.<br><br>The Salimgarh Fort has a small area housing the Swantantra Senani Smarak, which is a small museum highlighting the history of the Indian National Army (INA) of Netaji Subash Chandra Bose and its exploits. Some of the INA's commanders were imprisoned in this fort and trialed by the British after the Second World War, but were released, following a public outcry.<br><br>Once can also see a jail where these freedom fighters were kept as well as an abandoned mosque. The main railway line to Old Delhi Railway station cuts right through this fort and a pedestrian overbridge over this line must be climbed to get to the museum.
8;History Lover !! Don't Miss this  place;Salimgarh Fort is something that you will definitely miss if you don't pay attention to road signage. When you cross the Chhatta Chowk bazaar inside the Red Fort complex and turn towards the museum, the road leads to Salimgarh fort renamed as Swatantrata Senani Smarak.<br>Salimgarh Fort has its own share of gory tales but due to the absence of any structures barring a few barracks and a ruined mosque, everything else has disappeared with time. Built by the successor of the mighty Sher Shah Suri, Salim Shah, after whom the fort is named, Salimgarh served as an imperial dungeon for the Mughals. Perhaps, Aurangzeb and the Britishers put the fort in the best of use where hard-core prisoners are put into trials and death.<br><br>Don't miss seeing the Indian National Army(INA) soldier's memorial exhibition. Also, there is a jail which is in pretty much bad shape due to the absence of any preservation work. One of the few rooms inside the jail served as the last surviving solitary confinements that supposedly housed the three Indian National Army(INA) soldiers namely Col. Prem Sahgal, Col. G.S Dhillon and Major Gen. S.N Khan before the famous Red Fort Trials in '46.<br><br>Visit this place before you enter Red Fort. It will be in chronological order.
8;Salimgarh Fort;A place that you can enjoy your free time with your friends and that its a historical fort that will excite you.
8;Nice;A nice place to visit. Often very less crowded, this place reveals some of the facts of Indian history.
8;Lost in time;Not many tourists reach the Salimgarh Fort after several hours in the Red Fort. Most likely nobody else but you will be there. If you are interested strictly in history or architecture, you won’t be very excited.  But if you are a time travel enthusiast, this place is for you. Time stopped there about 150 years ago. Nothing was restored or improved from then on.  You will see the same Yamuna River (no matter how terribly it is polluted now), same walls, same ruins lit by merciless Indian sun.  Turn on your imagination and enjoy!
8;;
8;;
8;;
8;;
8;;
9;spectacular street show, from a rickshaw;try a rickshaw, from Jama Masjid to the spices shops, passing on the main road to Fatehpuri Masjid, and if you are lucky to find a celebration of Ganesha, for instance, the show of the street will be spectacular<br>mad traffic, I really don't know how come we did not touch somebody in that colorful crowded alleys they call streets<br>that kind of experience could give you an idea about real life in a great Indian city<br>do not avoid it, try to interact as much as possible
9;Crazy Morning Enjoying the Sights of the Delhi Spice Market;We think this the essence of India, well away from the regular tourist traps. We know this because this is a very busy area with all the locals going about their business. Our tour guide arranged a Tuk Tuk to transport us about 1 kilometre from where the bus parked to the marker proper. It is very organised in an Indian way. With local vendors selling their wares in front of little shops that open around 10.00am. Once this time passes they disappear and the shop behind starts up. Let us be direct by western standards the smells are just plain awful, but from the locals perspective that is normal. A spice shop we stood in front of was nearly overpowering from the many ground and whole spices on display. The streets are chaotic with Tuk Tuks, motorbikes, wheelbarrows, people, cars, cows, bulls and finally tourists all trying to navigate the broken and uneven ground. To sum up terrific and a must see. Just do not miss the spaghetti of wires where power is distributed, just crazy but apparently safe!!!!
9;NOW THIS IS CROWDED, BUT INTERESTING IN PARTS;As part of our tour we were taken on  a three wheel tuk tuk ride down this crowded,cramped street/alley. Probably no more than a couple of metres wide.<br>The lane was lined either sides by very small shops selling mainly women’s clothing<br><br>This area was built in the 17th century and includes the India’s largest wholesale markets<br><br>Tourists are taken down through this famous market in a three wheel rickshaw. It is crowded and there is really insufficient time to take it all in.constantly hitting holes and bumps in the alley , and narrowly missing similar vehicles coming the other way.<br><br>Once out of this "tourist run" the rest of the tour through the bazaar was relatively interesting. Many spices shops, and small enterprises all trading mainly with locals<br><br>The btuktuk ride really could be dispensed with. A total walking tour would provide more insitre to this bustling and colourful area
9;Not in the morning;Go to Jama Masjid, right in the heart of Old Delhi, and take a rickshaw for a quick exploration . . . just don't do it in the morning (as our guide suggested), because everything is closed. It is a labyrinth of narrow lanes with hundreds of shops, selling everything you'd ever want - and more.<br>In any case, go back later in the evening and try the best of Indian street food.
9;Amazing experience at Chandni Chowk in the evening with Anubhav;What an adventure! We came to India to experience the chaos of colour, smell, and the crowd that we have heard so much about. Going to Chandni Chowk in the evening is the best place to do that, and it blew our expectations. This food tour is much more than what we have expected. <br><br>Anubhav as our guide, and without us knowing, he is like a local celebrity here where we kept encountering people coming up to say hi and took photos with him. We were in good hands, where he brought us all over Chandni Chowk, the spice market, visiting the small food shops and street food stores, local restaurants, going in and out of little alleys while explaining to us every little things that we need to know with knowledge and passion. And he only brought us to places where the food were safe for foreigners like us to consume. <br><br>The market is a very chaotic place, and we would not be able to make sense out of it. We join this tour expecting to sample some local street food, but we got a lot more out of it. It is a glimpse into the life of the local people too.  Highly recommended.
9;Amazing!;If you want to experience the full force of Delhi’s atmosphere, no trip would be complete without a trip to Chandi Chowk. The place can feel insane and overwhelming at times, but the place is full of life and incredible gastronomy: an experience I will never forget! If you’re ever in Delhi, you must visit this fantastic market. It is the adventure of a lifetime.
9;A busy place in heart of Delhi.;A busy place in heart of Delhi. The walkway is good. From 9 am to 9pm only vehicles allowed there are e riksha. So it is relatively less crowded and less polluted. There are shops on both sides of the walkway.  <br>Red fort and parathewali galli are close by.<br>We visited it on July, looks like not so good time to visit.  Winters will be better here. But then it will be so crowded.
9;Tourist coming to Delhi, should spend some hours here;We visited Chandni Chowk several times in November 2021 to purchase bridal dresses. There are specialized specific markets called 'Galis' for most of the items you want to purchase. Both wholesale and retail business go together in a same Gali. Chandni Chowk is well connected with Delhi Metro. Car parking space are few and are always near full. One can not drive car here, as it is not allowed. Chandni Chowk after renovation is easy to walk and enjoy. Red stone is used on the roads which resemble stone used in Red Fort. You can use E-rickshaw to travel there. If we are in here, it is not possible to go back without the taste of Old Delhi. Every Gali or corner has shops, stalls and Khomchas selling local delicious foods. One should always try 3-4 types of items at separate shops. The taste will be there with you forever. Any tourist coming to Delhi, should spend some hours here. Several historical places are there nearby.
9;Must avoid;Worst place.. Nothing to watch or enjoy. Just crowd and thugs. Delhi has many other better places to offer. Try to avoid it
9;Satiate Your Taste Buds;Outstanding place for street food lovers and shopping birds. Come here and satiate your taste buds with chaat and other delicacies.
10;Lovely architecture;Beautiful architecture and grounds. Only chose to visit this site because it was so close to the Lodhi Gardens but so glad that I did. Well worth a visit and some lovely grounds to sit and enjoy
10;Beautiful Ancient Architecture;A beautiful ancient architecture spread in vast place. It is fine example of beautiful Mughal architectures.
10;Beautiful Architecture;Located at a walking distance from Jor Bagh metro station, this is a fine example of beautiful Mughal architecture. The place is clean, well maintained and peaceful as very few people visit this place which is actually quite surprising. A couple of hours visit is recommended. Photography is permitted.
10;Beautiful architecture and history.;This beautiful tomb complex from the late 18th century displays Mughal architecture at its best and is less crowded than other sites around Delhi and Agra. The blend of local sandstone and marble brings out the superb colours depending on the time of day you visit. Allow an hour to take in the complex and enjoy the peace of the grounds. We had a guide which helped with the explanations and history.
10;Stunningly beautiful;I visited on a week day in December at 9 am in the morning . Almost had the place to myself . What an experience !!! Intricate stone carvings , beautiful views and serene views! Loved every minute of it !
10;No crowds while enjoying park like atmosphere;Gorgeous Taj Mahal like structure in a park setting with no crowds. Come hear for great photography, and historical site. We also saw parrots and a peacock while here.
10;Lesser known, but just as impressive;Another huge mausoleum built by a Mogul emperor, Safdarjung, this being the last of the major monuments that include those at Lodhi Gardens and Humayan’s tomb.  Set in a very large walled garden it is an impressive building on the scale of the much more visited, and twice the price, Humayans tomb ,and without the tour groups. A peaceful place to spend a while admiring the striking architecture.
10;Nice place;It's a very nice a good place with a beautiful tomb which is situated in the middle , architecture was very good you can find peace in this area , it's an also good place for photoshoot or video making
10;Beautiful tomb with clean gardens;Beautiful and very well maintained place. The gardens around are also very well maintained and very clean. I went on Saturday at 10PM and met only few people, so I assume the place is not so popular.
10;Safdar jang tomb : mughal architecture;Nice place. Well maintained.People can spend some time here. We went there in the month of November. very few tourist were there .entry fee 25 Rupees for indians.
10;Beautiful garden around the tomb;Tomb is not much maintained, but it's beautiful . Garden around is good to relax. I went for photography.
10;ok;Safdarjung’s Tomb in Delhi is a famous attraction that is made of sandstone and marble mausoleum and it came into existence in 1754 It is open on all days from sunrise to sunset entry For Indians: Rs.15 and for foreigners: Rs.200.
11;Delhi's treasure!;Intercat cravings it was magnificent with details, all on granite stone I think.<br>It was extremely hot in April but was very cooling inside. The detailed cravings on the entrance of the celling was breath taking. A stop should not be missed.
11;Historical interest;Fascinating site, it's worth getting a guide to explain the historical and cultural significance of the area
11;the skyscraper of the past;remarkable construction, a real skyscraper of the past, still functional<br>a Hindu temple transformed in mosque, but the Hindu heritage is still visible<br>and the mystery of the old metallurgy, the iron pillar still not touched by rust<br><br>and a sign of the Hindu behavior - the squirrels are so relaxed, no stress regarding people
11;Amazing history in delhi;I have visited this sight twice in my life, each visit the sun was out and had experienced guides. The  mughal history here alone is something, its the tallest muslim minaret in the world but the ruins were destroyed by an earthquake, its interesting how you can see remnants of hindu architecture.  This is a fascinating place and a must see in Delhi.
11;Worth the visit;I went on a Sunday which I assume is busier than normal. Amazing monument with easy to read information boards.
11;Beautiful place;Beautiful place . <br>Went in the month of Jan. Learnt so much about our history. You can take a a guide also if needed
11;Best place;A true marvel of ancient engineering, Qutub Minar is a must-visit for anyone interested in exploring Delhi's rich cultural heritage.
11;Tall tower;Qutub Minar is an awe-inspiring structure that leaves visitors spellbound with its historical significance and intricate architecture.
11;Quotable minar;Qutub Minar is a must-visit attraction in Delhi. The towering minaret and the surrounding ruins are incredibly impressive and provide a fascinating glimpse into India's rich history and culture.
11;Qutub Minar: A Must-Visit Historical Landmark;Qutub Minar, a UNESCO World Heritage Site, is a must-visit for everyone, including locals of Delhi. Despite its historical and architectural significance, many locals tend to overlook it, taking it for granted. However, the towering structure, which dates back to the early 13th century, is a fascinating sight to behold, with intricate carvings and inscriptions adorning its surface. The surrounding gardens and ruins of ancient structures only add to its charm. Visiting Qutub Minar is a great opportunity to learn about India's rich history and culture, and appreciate the beauty of this magnificent landmark
11;FABULOUS ARCHEALOGICAL SITE. SERENE SURROUNDING;This tower, set in magnificent grounds and containing ruins and remainders of various religions etc, is 73 metres high. The entire area is an archealogical delight with lots of intricate detail inscribed on walls, and the Qutab Minar<br><br> It is a victory tower built in 1193 immediately after the defeat of the last Hindu Kingdom in Delhi.<br><br>The tower if truely magnificent in its own right. There are five quite distinct levels but no cement used. All the bricks are  interlocking. <br><br>The entire area is one where one could relax and simply take in the magnificence and tranquility of the area.<br><br>A definite must see
11;Tallest brick minaret;The Qutub minaret is only a part of this UNESCO complex, which is a wonderful example of early fusion between Muslim and Hindu traditions. Originally build around 1200 in red and grey sandstone, it was later added to and the fourth story is in white marble. It is worth looking at the tower in detail, because it is covered in exquisite calligraphy, decorations, pilasters, balconies and Muqarnas corbels. Depending on the light, it is a gem to photograph from different angles.<br>While the tower is the main drawing card, there are other interesting structures in the complex : the oldest surviving mosque, some columns (leftovers from earlier Hindu temples) and an iron pillar dating back to the 4th century.<br>Easy to spend a few hours taking it all in.
12;Delhi's treasure!;Intercat cravings it was magnificent with details, all on granite stone I think.<br>It was extremely hot in April but was very cooling inside. The detailed cravings on the entrance of the celling was breath taking. A stop should not be missed.
12;Historical interest;Fascinating site, it's worth getting a guide to explain the historical and cultural significance of the area
12;the skyscraper of the past;remarkable construction, a real skyscraper of the past, still functional<br>a Hindu temple transformed in mosque, but the Hindu heritage is still visible<br>and the mystery of the old metallurgy, the iron pillar still not touched by rust<br><br>and a sign of the Hindu behavior - the squirrels are so relaxed, no stress regarding people
12;Amazing history in delhi;I have visited this sight twice in my life, each visit the sun was out and had experienced guides. The  mughal history here alone is something, its the tallest muslim minaret in the world but the ruins were destroyed by an earthquake, its interesting how you can see remnants of hindu architecture.  This is a fascinating place and a must see in Delhi.
12;Worth the visit;I went on a Sunday which I assume is busier than normal. Amazing monument with easy to read information boards.
12;Beautiful place;Beautiful place . <br>Went in the month of Jan. Learnt so much about our history. You can take a a guide also if needed
12;Best place;A true marvel of ancient engineering, Qutub Minar is a must-visit for anyone interested in exploring Delhi's rich cultural heritage.
12;Tall tower;Qutub Minar is an awe-inspiring structure that leaves visitors spellbound with its historical significance and intricate architecture.
