poiID;title;text;
1;Best Place to Buy Shalwar Qameez;Amazing place for shopping. Especially if you are going to buy cultural dresses, there is no better place than this. Choose a day where there is less traffic otherwise you would have to spend many hours on the road.
1;Bazaar shopping;This was my 3rd stop of my 1/2 day Lahore tour . Delhi Gate was the entrance to shahi haman , bazaar , walking distance to Masjid Wazir Khan . Can see the daily life of the locals , can bargain here for clothes , scarves, khussa shoes etc .
1;Very interesting place;This was the first time I had travelled to Walled city Lahore with my friends. The expert WCLA guide Fatima who accompanied us was outstanding - passionate, informative, engaging and entertaining. The itinerary was very well thought out, I would highly recommend this company to anyone wanting a fun, relaxed, educational holiday - they will deliver!<br>We travelled from Lahore fort to Delhi gate by Rangeela Rikshaw. A local ride known as Rickshaw is prepared in traditional truck art design and is popular among the masses as Rangeela Rickshaw. The tourist avails this ride for touring inside the walled city of Lahore. The Rangeela Rickshaw is used as a tourist ride on designated routes inside the walled city Lahore only.<br>
1;Tick the box;This is one of the twelve gates into the walled old city. Though you cannot find all twelve now. This one is massive and seems to have been reconstructed at some point. Originally built by the mughal emperor Akbar.
1;Historical  Lahore.;Gate is beautiful but there were no signs leading upto it ,no designated parking areas for visitors and no guides available and a very lame excuse was  given for it .Shahi Hamam and Masjid Wazir khan are within walking distance to it.
1;A Gate to History;I would strongly recommend travelers to visit this ancient gate,which tells its own story.Mostly the buildings are of Mughul period,fascinating building structure,woodwork.
1;Organized Cultural Tours for Our Guest;We have organized many cultural and heritage tours for our guest . People just know about the dehli gate but there are a lot of heritage that are still hidden . This was the famous place of Prince DaraShakoo who was the Son of ShahJahan he made path with the red stone to pay tribute to His spiritual teacher Hazart Mian Meer in this place . The places is well restored by Agha khan Foundation and walled city  and that was only the gate that King Akber mostly used it to enter the Lahore City <br>Highly recommended to see this place
1;main entrance to the old city;The market and hustle and bustle are worth a look. Steps away are the Sahi Hammam and the beautiful Wazir Khan masjid.
1;Could be much better...;This is one of the 12 gates of old Lahore city and the one that straight leads to Wazir Khan Mosque. Vehicles are not allowed inside beyond the gate. The area around the gate is very crowded but if one wants to get the taste of old Lahore, this (along with Wazir Khan Mosque that is few hundred yards inside the gate) is the place to go. Lot of small houses with old wooden balconies and small shops selling traditional goods that one may not find in modern Lahore. <br>Parking could be a problem and one may have to find a place that could be 300 to 750 yards away. The gate doesn't perhaps merit an independent visit but along with Wazir Khan Mosque, it forms a good package.
1;Excellent;I have my dad's shop there...when we enter that huge gate..the market starts and we get to see old buildings and many sikh traders over there..
2;Beautiful complex but no easy access. See it from the outside;It is a distinctive and magnificent building complex. A true classic in its style and architecture. Best to see it externally. Between the intense traffic and the place being heavily guarded the direct access is practically impossible. Admire but from the outside
2;Better view on TV screen!;The entire area is cordoned off and so we were not allowed to go anywhere near the building. The view from a distance didnt do justice to its grandeur. The visit was so poor that the BSF posted there even shoo off cars dropping the visitors. Things should be managed better and tourists shouldnt be shooed off like stray cattle!
2;Nice evening visit;The best way to reach here is to get down at Central secretariat metro station and walk down. The view at night is beautiful after the buildings are lit.
2;Circular in shape;Edwin lutyens had designed this building in 1912, and construction was completed in 1927. It is believed that lutyens inspired by the design of the Chausath Yogini temple in morena dist. in Madhya Pradesh and incorporate the circular design.<br><br>Very impressive building but only outside glimpse is possible as entry is restricted.
2;Evening visit;We are arrived at about 6 in the evening and it was a quiet time to view the magnificence and scale of these buildings. We noticed a sign that a light show was to start at 6.30 pm and this covered the buildings in various hues of colour making it all the more striking. it is certainly one of the main sights to see, the grandeur of the architecture from colonial times and so at odds with the drama of other parts of the city.
2;Enjoyed the architecture;While in the area for India Gate, our driver drove us by so we could see the beautiful building. The flowers and areas near by make it a lovely spot.
2;Parliament House Museum;Parliament House Museum is a nice place for our history and constitution. You can see here debate in Lok sabha and Rajya sabha. For entry passes are necessary.
2;The Sansad Bhavan;This is an impressive building, equally as impressive as the Rashtrapati Bhavan the former housing the Parliament and the latter, the President of India. It was constructed between 1921/1927. As with many other buildings and attractions, we had to be satisfied with a drive past on 7/10/19, barricading and armed security everywhere. Apparently it is possible to obtain a general entry pass if the House is not in session. Grandiose.
2;Nice;Indian parliament is one of the best place in India to know our history and lovely place it was .located in sansad Marg New Delhi
2;India’s Lok Sabha and Rajya Sabha both Houses of Parliament;This is an architectural beauty and a circular building. British had made it in 1920s. Both Lok Sabha and Rajya Sabha, members transact business here for discussions and former making laws for the Indian democratic Republic. You must spend lot of time to understand the working of this place. <br>Amolak Rattan Kohli <br>Former Governor of Mizoram
2;A seat of Power of the biggest democracy of the world;The impressive round building is a treat to eyes. Done up in Victorian style speaks a volume about the seat of Power of the biggest democracy.
2;Worth a look;Probably not a stand alone attraction, as we could only do a drive past, however it was a very impressive Building (built by the british in the early 1920’s) to see, as it is the centre of the worlds largest democracy.
3;Lovely;Huge and beautiful, Rashtrapati Bhawan strikes you with its grandeur as it comes into view from afar. The walk from there to India Gate is just astounding for the superb views all around.
3;Fabulous once in a lifetime experience;Took the tours of circuits 1, 2, 3 on same day. Its definitely an experience to visit these places once in a lifetime. The Circuit 1 is for the main building which is most difficult to get a booking as it opens 1-2 weeks before and has limited seats. Need to constantly monitor their website in order to book it. <br>Took the metro to central secretariat and then rickshaw (30 pp) to gate 35. Its convenient to first visit the Circuit 3 (gardens) in the morning between 10-12 as it could become difficult to walk around this hugh gardens in hot sun later. On way out their is a cafeteria where you can take snacks and lunch. Later plan to visit the museum (Circuit 2) through gate 30 which houses nice artifacts from history and has a nice guided tour. Finally took another rickshaw to gate 38 for the main building tour at 3 pm which lasts for an hour and covers all main halls inside the rashtrapati bhavan. Overall a once in a lifetime experience which tooks around 6 hrs and lots and lots of walking!
3;SIMPLY STUNNING IS SIZE;This is the home of the Governor of India , and official residence of the Governor. <br>It was constructed between 1799 and 1803 at a cost of R14M (about $A250000) one can only speculate what todays value would be!<br><br>This is an enormous building containing over 340 rooms and is situated on a 130 hectare garden. It is the second largest official residence in the world behind one in Italy<br><br>Its scale needs to be seen to be believed.<br><br>We only had the opportunity of viewing this building from the outside perimeter so could not fully vappreciate it for what it clearly is.<br><br>As we viewed iot from the outside only is reflected in the low score
3;Massive;The Indian Colonial rulers were always thinking big (it wasn't their own money they were spending) : first considered by Lord Wellesley, this behemoth was designed by architect Lutyens. It is now the 2nd largest residence of any head of state in the world, spreading out over 130 hectare.<br>Located opposite India Gate, it makes for a grand photo opportunity.
3;Official residence of the President of India;The complex is one of famous designs by Lutyens . There is a lot of history connected with Rashtrapati Bhavan. The tickets can be prebooked on line. Don’t miss the change of guard ceremony and Mughal Gardens
3;Must visit for every Indian;To view the rashtrapati bhawan was dream come true. The view and knowledge of the Indian history was superb and yes so well maintained. Proud to have visited.
3;Parliament House Museum;Parliament House Museum is a nice place for our history and constitution. You can see here debate in Lok sabha and Rajya sabha. For entry passes are necessary.
3;The Sansad Bhavan;This is an impressive building, equally as impressive as the Rashtrapati Bhavan the former housing the Parliament and the latter, the President of India. It was constructed between 1921/1927. As with many other buildings and attractions, we had to be satisfied with a drive past on 7/10/19, barricading and armed security everywhere. Apparently it is possible to obtain a general entry pass if the House is not in session. Grandiose.
3;Nice;Indian parliament is one of the best place in India to know our history and lovely place it was .located in sansad Marg New Delhi
3;India’s Lok Sabha and Rajya Sabha both Houses of Parliament;This is an architectural beauty and a circular building. British had made it in 1920s. Both Lok Sabha and Rajya Sabha, members transact business here for discussions and former making laws for the Indian democratic Republic. You must spend lot of time to understand the working of this place. <br>Amolak Rattan Kohli <br>Former Governor of Mizoram
3;A seat of Power of the biggest democracy of the world;The impressive round building is a treat to eyes. Done up in Victorian style speaks a volume about the seat of Power of the biggest democracy.
3;Worth a look;Probably not a stand alone attraction, as we could only do a drive past, however it was a very impressive Building (built by the british in the early 1920’s) to see, as it is the centre of the worlds largest democracy.
4;BEWARE: „Tourist information office“ scam at Connaught place!!!;At Connaught place (CP) in New Delhi, next to the „blue moon spa“ there is a small tourist information office. Be careful, they tried to scam me there!!!<br><br>My taxi driver was supposed to bring me to my hotel nearby CP, but stopped at the tourist info to ask for the exact location. The owner of the tourist office told me with many apologies that I cannot reach the hotel now since the roads were closed due to a Covid outbreak. He offered to call the hotel for me and ask how to get there (my phone didnt work with foreign sim card, i had just arrived in India). The tourist office guy was very friendly and put me even on the phone with somebody that pretended to be from the hotel and confirmed that the roads were closed, i should find a new hotel and they would refund me. Then the tourist office manager searched a hotel in another area and wanted to book for me, together with a driver to get there, all for a high but still acceptable price. I should pay directly to him since allegedly they are cooperating with the hotel. And that point I luckily good too suspicious and walked out to find a random tuk tuk which simply brought me to the original hotel, it was basically around the corner! All this story was an elaborate scam, involving the taxi driver, the tourist office guy, another person who acted as hotel staff, and probably the managers from the new hotel!<br><br>Lesson learned: Be extra careful arriving in India and always get a simcard right away to be able to check things yourself!
4;Worst experience;One of the worst place in Delhi. Shops get closed so early like it's a village in such a big city. People kept on staring at my girl l!! Real vultures on loose!
4;Just doesn’t feel safe;I have to agree with all the other tourists on here, the place looks nice in the photos but Connaught Place has been the place where we were constantly harassed, non stop , we have been travelling in India for the past three weeks and nowhere has been as bad as here, no one seemed to take no for an answer and just kept on following us , we left and won’t be going back
4;Nice Place;Visited here a few days back and found out the best market. Costly to Pocket Friendly option available. <br><br>There is a Market Called Palika Bazar where you will get Sasta and Tikau material in terms of Garments and all.
4;Do not waste your time;It looks nice in the photos, but its pretty ordinary, not worth one dollar tuk tuk ride to dry here. In the main old English White buildings, it is western stores at more than normal western (Australia) prices. The only other market around that is operating is called Indian Loom, which is one of those dodgy ridiculous marked up places where the tourist guide takes you so that they can get a commission on whatever you buy. So I’d avoid Connaught Place and Indian Loom, and spend your time somewhere else, I definitely recommend the Sarojini Nagar market, You can spend about three hours or so here and this is where you can pick up T-shirts and jeans for two and three dollars, iPhone AirPods for $10, Saris, belts, all the normal stuff you expecting cheap Asian countries.
4;Mr Shoes;I had a full split in both the rubber soles of my sandals as I walked through Connaught Place.  Initially I told the shoe repairer that approached me that I wasn't interested (the place is tout hell - you need to shut out everyting) but when he showed he'd spotted my broken soles and assured me he could fix them I asked his price.  220 rupees.  I said OK so we swapped sandals and he got to it.  He was great.  He glued the split and then used a real heavy duty black twine to sew the rubber soles together.  It looked like really good workmanship so I paid him 500 rupees.  <br><br>I think he said his name was Mr Shoes which in itself is brilliant.  He's a young guy, from Rahasthan,  pushy but respectful.  If you're in Connaught Place and need shoe work Mr Shoes is your man.  See pic. <br><br>But be careful - there's also some real scam shoe cleaners at Connaugt Place.  The day after Mr Shoes I got done by the 'poo on the shoe' scam.  (one shoe cleaner points out you've got 'poo' on your shoe and another bloke suddenly appears and suggests you get them cleaned).  I knew I'd been done but because of the language barrier I couldn't tell them them off.  I insisted on agreeing on a price of 100 rupees, he half agreed and I watched him closely to make sure he did a good job.  When he was done he said it was 250 rupees.  His mate suddenly re-appeared and said Indian prices sir.  I told both of them  flat out we agreed on 100 rupees and that's all he's getting.  I then gave him the cash and walked off.
4;Continuously followed;Stayed here for a week for work to go to a trade show nearby, not my first time in India. I could not leave the hotel to go for a walk at all. Shops and restaurants all over but every time I walked out of the hotel I couldn’t even go half a block without getting followed by someone trying to convince me to go to a government shopping center where I would pay no tax or try to get a free map. People would start off friendly but ultimately try to get you into a rickshaw. I walked the full inner circle and was hassled constantly by at least 5 separate people, as soon as you shake one the next comes over. <br><br>It was a real bummer I couldn’t do any shopping or try any of the restaurants in the area, had to go elsewhere for that or just get room service if I was lazy.
4;Some nice places, but constant harassment;Some nice restaurants and shops, but was continually harassed by persistent vendors from a local market trying to get me to go there.
4;Great shops but dangerous;Location wise -- tons of great restaurants and shops for you to browse and shop. The only reason why this is 2 star is because you do not want to come here alone.<br><br>Even as a male, you will get approached by multiple individuals trying to scam you, even trying to force you into a rickshaw at some point.<br><br>Unfortunately, I did not feel safe even once when I was at Connaught Place. I rushed what I needed to get and got out of there.
4;Busy and pricey;Not what it was years ago and very busy with more tha the usual traffic .   Can't say I would go back as far more interesting shopping and dinner spots exist nearby.
4;Be CAREFUL WITH SOMEONE ASKING WHERE ARE YOU FROM? I Dont NEED NOTHING ONLY TALK, STUDY ENGLISH or SOMETHING LIKE THAT;Cuidado com sua visita, cuidado com sua visita ao ser abordado por estranhos perguntando de onde você vem? Qual seu pais, não de confiança, são pessoas tentando te levar para algum lugar para que você compre algo não acredite que é para estudar inglês que não querem nada, que são estudantes, são comissionados, não há policiamento no local, TAKE CARE ABOUT PEOPLE THAT START ASK FOR YOU WHERE ARE YOU FROM, THEY TRY TO  to take you somewhere, I think to shop or be commissioned, but it could be some scam too, there is no police on site so avoid answering question or asking for help only say I dont need buy anything!!! Be rude !!!
4;Can't blame the location, but don't do it alone;We decided to explore and do it with just a transfer to the area. Expect to be accosted by attempted scammers - be careful, as they hand you off from one to the other.. check how they use their phones. Couldn't find any place to really shop where we felt safe. Wouldn't do without a guide.
5;Relaxing spot;This is a great place to have a relaxing walk. There are birds, squirrels and butterflies to enjoy. Well worth a visit.
5;Lovely park for a picnic or walk;We stopped at this park to see some local flowers and were surprised by the nice walking paths. There were also old structures to see which was very interesting. The park was large and weather just perfect for a quiet respite from the city.
5;Absolutely recommend;Visited the Lodhi Gardens alone on a beautiful, sunny Saturday afternoon. Not only are the gardens beautiful with historic monuments scattered throughout but they have an incredible atmosphere. Lots of groups of people enjoying the open spaces, relaxing, dancing and enjoying themselves. Take a book, find a shady spot and enjoy this beautiful oasis.
5;Recommended trip;Great place to visit. We did the park tour on our last day and it was quite relaxing. Best of all it’s free. Highly recommended
5;Gardens Tombs;When you need a break from New Delhi's crowds and traffic, spend a couple of hours exploring the garden tombs of Lodhi Gardens.  So peaceful with nice photo opportunities.
5;Beautiful Garden Oasis;A beautiful green garden oasis rich in history and beauty. Beautiful maintained and very clean.  A lovely and relaxing place to explore some amazing old tombs or relax with friends or a good book. A really nice place to take some time out of the amazing chaos which is Delhi. Would definitely recommend a visit here.
5;Lovely place;A huge park and garden in heart of delhi the vibe is just awesome if you go there at evening you might see some birds also.<br>Dedinatly worth to go ! Do visit if you are near by !
5;Lodhi;It is a nice place to explore greenery. I rated it 4 because of youth can be seen annoying but anyways you will enjoy the view even in the hot days.
5;BEAUTIFUL  GARDEN;Very  Nice  garden, full of flowers and ਲੋਟਸ of different species  of trees  and birds  its really awesome  to visit  there I recommend this garden  to  all
5;Love lodhi garden;Delhi's best park. I have had so many memories here and i love to go here for picnics with my friends. It is known for its historical monuments and lovely green sidewalks.
6;Not on the usual list of tourist sites;Had no idea this place existed but with a day to spare our hotel staff recommended a visit.<br>Easy to reach by taxi (and noticed metro not too far away) on the outskirts of New Dehli city<br>Interesting to wander around and look at architecture and enjoy the space. Went early in the day and avoided the crowds.<br>Looked to be well maintained with a number of grounds staff working around the site and maintaining the gardens and lawn
6;spending time with family;very best place for spending quality time with family and there is a lake also for baoting. a museum also for historic knowldge.
6;Please visit in mrng or evng..avoid 12 pm sun no shades;Not required to visit..its khandar now..no more quilla..only coupels come and sit in all places..quite embarrassing to take small kids..as couples dont have rooms..useless place..thank god there was no ticket..otherwise i would go crazy..not worth even a 1 rs
6;Nice place;another nice historical place here in New Delhi. old walls, including 3 gates (unfortunately without access), excellent mosque (Qila-e-kuhna masjid), interesting water well (20m deep with staircase!), and small museum in one area. nice, like it.<br>and again as foreigner one will pay 300r...
6;Nice place to visit along with zoo;Good place as one can spent some time after finishing zoo visit.<br>It has a small musium as well nothing special in musium but place overall god.
6;PURANA QILA, NEW DELHI;• It was a wonderful experience there.<br>• There were many things to see such as baoli, bada darwaza, and old monuments. <br>• Great place for photo shoot. <br>• There is a place under ground where it's path goes to trench but don't worry it is closed now. You can't go there. <br>
6;Ishq e dilli-the light and sound show of Purana Qila;We have heard a lot about light and sound show of Old Fort Delhi so we specially went to see evening light and sound show- Ishq e dilli in Hindi narration. The show covers the history of Delhi through its 10 cities, starting from the 11th-century reign of Prithvi Raj Chauhan to the present days. It also traces Delhi's connection with the mythology of Mahabharata and Indraprastha. The show was not up to the mark as far as projected images on the fort walls are concerned but we definitely enjoyed hearing the History of Delhi.
6;Lover's park;Totally new to Delhi went to Old fort (Purana Qila) and disappointed with the people around us. <br>It is just a place for lovers to make love and we felt uncomfortable to move around in the park being a tourist couple. <br><br>I would not recommend this to tourists and prefer Humayun tomb or Red fort instead. <br><br>Just don't waste time.
6;Light and sound show review;Only went there to see the 7:30 pm light and sound show- Ishq e dilli.<br>While the concept is very good however the quality of the show was fairly average. The projected images on the fort wall was not very clear. <br>The audio and narration was very good and We enjoyed listening to the history of Delhi..<br><br>
6;Definitely worth visiting when in Delhi;Purana Qila is a fort complex thats thought to have been in use in various guises since the 5th century BC and possibly even mentioned in the Indian epic, Mahabharata. The most interesting buildings in the complex are the Qila-i-Kuhna Mosque, Sher Mandal and the museum. <br><br>Definitely worth visiting when in Delhi, give yourself a couple of hours to see everything.
6;Huge fort;The place is very huge and it has its own history and best part will be the night view.It will be decorated with lights and music
6;Back to the 15th century Delhi;Good historic place to visit is you take interest in history and archaeology. It is very near to Nizamuddin Railway station and just adjacent to Delhi Zoo. Nice fort with ruined walls and lovely surroundings. You can connect with history of 15th century India (Especially of Shershah Suri and Humayun) while visiting this place. There is a Mosque also inside the fort. And the famous structure (built by Shershah and used by Humayun as library) where Humayun fell down from stairs and died 3 days later. It is well maintained fort and there is a museum also that brings out the history of Delhi. The ticket price is for the the fort as well as the museum is very nominal. Light and sound shows are also organised every evening at around 6:30 or 7:00 PM. Don't be surprised if you find young couples displaying public affection as this place provides many secluded areas where one can be more adventurous.
7;Red Fort nice experience;It was great! Really a nawesome experience. One must definitely visit this place. The front half of the fort is of red stone and other half is  of marble. Feels glorious for the first timer. Also it has a couple of museums depicting the freedom struggle. And there is a shopping street where you can get most of the decorative and ornaments too...
