poiID;title;text;
22;Bridge with Historic Icons;This bridge has some notable elements to it and is great for pics from above - i.e. across on the Buda side from up the hill. The bird statues on the bridge are models of the Turul bird from legends of Hungarian lore. There's also the Hungarian coat of arms prominently displayed. Nice bridge to see and drive/walk over. Just avoid being a lame tourist and attaching a lock to the bridge - it's tacky and unless you're from Budapest it leaves another task for city workers as they eventually have to cut off the locks. Respect the site.
22;Shortest in Budapest;Liberty Bridgeis known as Freedom Bridge and connects Buda and Pest which located inbetween  the River Danube and is green in colour. <br><br>It is the shortest bridge in Budapest's city centre.. <br><br>This bridge was the first rebuilt in Budapest after World War II.
22;The Iron Lady!;Great old Iron bridge. built near the end of the 1800s,  Great views from the bridge and the structure itself is fabulous.  Pedestrian walkways on both sides of the bridge. Beautifully lit at night, accents the light green color of the bridge.
22;Leave a lock;One of the 3 major bridges in Budapest linking Buda to Pest, we wandered on for a stroll and attached a lock where we found a few others on the bridge.<br>Great photo opportunity and close to the Grand Market.
22;A Bridge;It's an iron bridge over the River Danube,painted green,seperate walkways protect pedestrians from the traffic as they cross the river.<br>       Built in the late 19th century was originally named Franz Joseph Bridge and runs from the Great Market Square on the Buda side to the base of Gellert Hill on the Pest side.<br>       You can get some great photos of the towns from here.
22;The green bridge!;Going fro Buda to Pest and back we had walked over this bridge several times. Offers great view of the river and the city ( both banks of the city).
22;Lovely Bridge;Loved this area and bridge.  Up there with tower bridge and the Charles bridge in Prague.  Still not as good as the Tyne Bridge but what is. ….
22;Not just a bridge;this is not just a bridge, it looks very cool and you can walk safely away from the cars. Just look out  for cyclists!
22;Crossing the Danube;Well, it is a bridge, it is green, tourists like to climb on it and it connects Buda to Pest. Although I like to read up on things it seems thay Budapest is happy for its tourism industry to rely on drunk stag and hen parties. The artistic, historic and architectural beauty is ruined by limosines full of bellends
22;An attractive art nouveau design bridge across the River Danube.;We stayed quite near this lovely bridge when spending several days in Budapest.  The bridge was built between 1894 and 1896 featuring art nouveau design and is 333.6m in length and 20.1m wide. The top of the four masts are decorated with large bronze statues of the Turul, a falcon-like bird which is prominent in ancient Hungarian mythology.  The bridge had to be rebuilt in 1945 after World War 2.<br>We walked over the bridge during the day from Buda to Pest and it offers great views of the River Danube and both sides of the City.  Trams, cars and pedestrians use the bridge.  It looks great illuminated at night and would make a nice spot for a romantic walk.  When walking the bridge look for the small old man in a boat sculpture that is locked to the bridge railings (See my photos to understand what you are looking for) he is on the right-hand side railings as you walk from Buda towards Pest.
23;The "Garden of Philosophy" is a must see!;The Mucsarnok is a beautiful art museum on the Hero's Square. It is a neo-classical building inside and out.   My absolute favorite part was the "Garden of Philosophy" exhibit.   It is an eight-figure sculpture placed at the focus of the exhibition.   The sculptures were 3-D printed!
23;Nice stairs;Looks nice from the outside. I've never been inside. However, the stairs are a pretty good place to sit and rest.
23;A great looking building;Located right across from Heroes Square this is fantastic looking building that displays works of modern Hungarian and International Artists. <br><br>You can't miss it when you visit Heroe's Square. <br><br>Worth entering for any exhibition. I liked it very much
23;Graceful neo-Classical palace with contemorary art exhibits;The Palace of Exhibitions (Mucsarnok) is a contemporary art museum on the southeast side of Hero's Square.  The neo-Classical building (architects Albert Schickedanz and Fülöp Herczog)  was completed in 1896 for the millennium celebrations.  Standing in Hero's Square, I admired its graceful Greek Revival portico: six columns surmounted by a pediment with a colorful mosaic of St. Istvan (the patron saint of fine art).  Inside, large exhibition rooms were decorated in neo-Classical style, with tall ceilings and soft light from skylights.  The Palace of Exhibitions is run by the Hungarian Academy of Arts. it does not have a permanent collection.  It offers temporary exhibits of contemporary Hungarian and international fine art (check the web site for what is current ).  The palace has a bookshop, library, and the Műcsarnok Café overlooking the square.  The building is beautifully it at night.   The Palace of Exhibitions is open 10am to 6pm daily Tues to Sun, except Thurs, noon to 8pm, with an entry fee of 800 HUF (discount for students, educators, senior citizens ).
23;Note: No permanent collection;The Palace of arts next to Heroes Square is a gorgeous building - it is important to note that it has no permanent exhibitions. So, what it there to see will always be changing. The building itself is not terribly large, so if what is currently on exhibition is of interest, you could probably see it in less than a couple of hours.
23;The displays were ok but not my kind of art;We brought Budapest cards so we could access most visitors sights. The displays were all photographs which wasn’t to my taste. But that’s the beauty of art we all like different. The ballet display was nice and the photographs were very clear. Staff were unhelpful and rude. I wouldn’t go back as the displays were very small.
23;Interesting exhibition;I visited this museum as it was included in Budapest card. The exhibition was interesting, but I expected more art.
23;Boring as hell;We expected actual art but the whole museum had nothing of interest and no art. It was very boring and also not as big as it looks from the outside. Don’t go here, such a waste of money.
23;A feast for the eyes;The exhibits are examples of objects made by masters of old crafts, many of them are a modern twist on old skills so they could absolutely be incorporated into the modern home / contemporary fashion. Everything can be found here from furniture, clothes, everyday objects, instruments to jewelery, including crafts like woodcarving, weaving, embroidery, felting, leathercrafting, pottery... Definitely worth a visit for the art enthusiasts.
23;A pleasant surprise not seen by many;While visiting Hero’s square on a Hop on Hop off sightseeing tour  bus, we noticed the Palace of Exhibitions (Mucsarnok), a graceful building opposite the Museum of Fine Arts (Szépmüvészeti Museum), on the other side of the square. The Palace of Exhibitions was built in the eclectic-neoclassical style between 1900 and 1906 from the plans of Albert Schickedanz and Fülöp Herzog.<br>It an interesting building with no real permanent exhibitions, it seems that different artists showing their work with government support. Some of the pieces were really beautiful and very different.  <br>  The Entrance fee was only $8:00, and it also made nice shady break from the warm sun. We stayed a little longer and caught a later Hop on Hop bus.<br>TIP: We strongly recommend this bus tour, as it gives you a complete over view of the city’s sights.
23;Great temporary exhibitions;My boyfriend and I visited the museum in September last year. We were lucky to see an exhibitions of Sebastian Salgado's images and Jozef Suchoza artworks - both exhibitions were stunning! Because the exhibitions are changed relatively often, I would recommend checking the museum's website before visiting. However, basing on what we saw, Mucsarnok is successful at creating well-curated, modern exhibitions. Must-see for any contemporary art lover!
23;European Tour.;We were looking for a museum to go to Budapest on our free day. We come across the Mucsarnok, looked very nice form the outside. In side the exhibition was on local culture from all over Hungary. All we can say it was breathtaking. What we learnt about costume, pottery, dance and tradition. We done Budapest.
24;Great museum with a range of displays;Came here for a Bosch exhibition, and was not disappointed. In addition to the Bosch displays, there was a wonderful range of art work from a range of timeframes to enjoy. A must visit when in Budapest.
24;Great collection;If you are into paintings this is the place to be! Such a beatiful collection. We spend about 2.5 hours in the museum but could not see it all. The collection is nicely organized by style/country and period. Dont miss out on the great pieces by Cranach and Rafael.
24;Beautiful;Beautiful Egyptian and Greek collection underground in a beautiful building. The museum is beautifully arranged. There is a free cloakroom. Unfortunately, I didn't have the energy to see the rest of the museum but it seems to me that it would have been worth it. Overall, great experience. Free with the Budapest card.
24;very interesting;the building itself is very impressive. The collection is very interesting and worth a visit. the facilites are also excellent with a very clean and organised cloakroom and toilets. The bar and restaurant are very clearly marked for allergies and quality of food is excellent.
24;For art sake!;The museum is located adjacent to the Heroes Square and is a grand structure in its own right. We didn't have time to enjoy the exhibitions, but the building itself is a work of art.
24;RUDE STAFF;Men at entrance  VERY RUDE.  NO access to  Cafe or washrooms after spending over 100EUROs in the shop. Not helpful or even  polite.
24;My favorite art place in Budapest 🇭🇺;The Museum of Fine Arts Budapest is Hungary's largest and finest art museum. Its collection includes thousands of artwork from prehistory to the present. Old master paintings (13th to 18th centuries) was my favorite containing over 3000 paintings in the collection. If you enjoy art and paintings, make sure you allocate 3-5 hours to this museum. Felt that the Fine Arts Museum was above the Hungarian National Gallery in terms of display of art, more organized and the visit was more structured. This museum was my number 1 most enjoyed experience in Budapest. Entry price: 11EUR
24;Bosch exhibition;One of our main goals of visiting Budapest was the Bosch exhibition. It was an extra, that we could watch all exhibitions with the Bosch ticket, so we took the chance. It's a great building with lots to see, we seen hours here. Even the building itself worths a visit. There are many artifacts here from different eras of history. If someone likes arts they should certainly spend some time here.
24;Rude staff which do not speak English. Silly security rules.;The staff are all elderly and none speak English! Whether you bought a ticket online for a specific time is irrelevant to them, you have to queue anyway. If you have a bag it needs to be searched. After searching, it still needs to be deposited in the cloakroom. What is the point of that? If you get too close to the paintings, the staff give you a rude telling off in Hungarian, despite there being no signs stating in English how close you can get to the paintings.
24;Nice Visit;It’s a very good Art Museum - not great. If you like religious themes, you’ll love it as that seems to be the emphasis. We went for the Bosch exhibit which was also very good - not great. We walked here from the city center in about an hour. Kind of confusing to track rooms you’ve visited, but after a while, the art seemed all the same to me. Next to Heroes Plaza added to trip worthiness.
24;A first class art museum;A first class art museum. Great orientation for guests from abroad. Beautiful premises. The Bosch temporary exhibition was fabulous, with precious art and good documentation. The permanent collection has a few highlights that should not be missed. The panel describing these in the entry hall is worth consulting. As an advice - book tickets in advance to avoid the lines.
24;Badly Organised;Bought a ticket line for the Permanent Collection and had to wait 1 hour outside in the sun.<br>What’s the point of buying a ticket in advance when people who arrive after you without a ticket get in before you.<br>Once inside the art is fabulous, hardly anyone inside…they’re all queuing outside.<br>You should have 2 lines one for people with Hieronymus Bosch Tickets and one for people who have tickets for the permanent collection.<br>Won’t return.
25;<span>Learn more</span> about animal welfare in tourism;Fabulous park. Well worth a walk round..
25;Fabulous park, open air swimming pools massive! Water slides, Spa baths. Mini zoo statues about every 100yards. Running track sports arena. The list goes on. Lovely well kept gardens grass area to sit and picnic. Several cafe and bars kept to just one area. If you wanted there were peddle bikes or electric cars, and regular bikes to hire.<br>   Just a lovely place to spend a leisurely sunny day. A tad disappointed sat for 25 minutes to see and hear the music  fountain supposed to on the hour, it didn't!;Nice park but pools undergoing maintenance and take your own towels!
25;Firstly I enjoyed the green space, peace and quiet after the busy city of Budapest.  However, if you go to Budapest you know it's a busy city so maybe needing some space is a contradiction!  If you have small children that have tired of the sights I would definitely recommend it to let them round around freely for a few hours.<br><br> My big disappointment were the pools.  Only a very small section are open but you don't know this until you have paid full price and gone inside.  Regarding the towels - I had read on a website that they were provided but they are available to PURCHASE - not rent or lend.  They were really expensive (I think about 40 Euros each).   We had chosen to visit these pools as opposed to any other as I thought it would be nice to experience them in a park but from what I understand the main ones in town are better.;Get out of the city without going anywhere
25;We were a little early in the season for the gardens and restaurants to be in full swing.  It is a nice green space to get out of the city without having to get out of the city.  The ruins of the old church and convent are an interesting view into Budapest's past.  The quaint little free zoo on the island was a fun addition to our quick visit, nothing too outstanding but a nice way to get up close to some wildlife. I wish we could have been there to see the Japanese garden in full glory, but even for early spring it was a relaxing and beautiful place.  The biggest negative to the island is the horrendous eyesore of a hotel/spa at the far end (opposite Margit bridge) of the Island.  All in all, I would highly recommend getting away from the hubbub of the city and spend an afternoon in the middle of the Danube.;Calm and peaceful place
25;Really lovely and peaceful place. Wonderful if you are lucky like we were and the weather was gorgeous. No traffic so very calming and relaxing. Avoid the Steg Pub as this is a hostel pub so loads of stag dos there when we went.;Island life
25;Nice island on the Danube, good for a walk, and take in the views, nice cafes, quiet with little traffic access;Good filler activity
25;<span>Learn more</span> about animal welfare in tourism;My most favorite place in Budapest
25;Margaret Island is an island in the middle of the Danube River.  It can be access at the middle of the Margaret Bridge.  It is actually a huge garden with free entrance.  There is a running / walking path along the river but not sure if it is around the whole island as we walk along just the path facing the Pest side.  <br><br>There are some cafes and restaurants.  However some were not open early in the morning when we were there.  There are some toilets (you have to pay) but they were all closed at that time.  The best bat is go to one of those restaurant to eat and use their;Biggest Green Oasis!
25;Margaret Island is Budapest’s biggest green oasis – accessible by foot from the middle of the Margaret Bridge. The whole island is a huge park home to a Medieval Church ruin, a lovely Japanese garden, century-old towering trees and endless picnics.  The centerpiece is a large fountain that lights up and “dances” to music every hour from spring to winter – the 9 pm show is enhanced with a multimedia screening that displays images of Hungary’s greats projected onto a water curtain.  The Margaret Island park’s fountain actually plays a coordinated musical show every hour from 11 am, but the best time to visit is for the final, much longer show at 9 pm. You’ll be treated to a choreographed fountain, light, and music show set to popular songs from a variety of genres. It’s a great, free thing to do in Budapest at night (or, if you opt for the day show, to combine with a stroll around the park).;Lots to see and do
25;We walked the length of the island enjoying the Japanese Garden and views of Buda and Pest. Easy to get to on public transit. We also had our first Langos on the trip. Wandered the Dominican convent ruins.;Wonderful
25;Doing a boat trip along the Danube River we stopped off at Margarets Island for a visit after being mentioned by one of the boat guys ...and glad we did...The island is small but so beautiful, abundance with trees, flowers , green oasis, different gardens and a park and pathway I so much loved. Never stopped for drink or food at the  bars but quite happily stood and listened to the large musical fountain until was time to catch our boat back.. A Lovely place for picnics or just some peace n quiet if that's what you looking for!  Loved it !!!!;Nice Island
25;We cruised around the island as part of a Danube Sightseeing Cruise. Looks a nice enough Island, quite large for walking. The cruise allows you to get off at the island and get a later cruise back if you wish. The Margaret Island bridge is also impressive;Lovely park, let down by a very rude staff member!
26;Great museum with a range of displays;Came here for a Bosch exhibition, and was not disappointed. In addition to the Bosch displays, there was a wonderful range of art work from a range of timeframes to enjoy. A must visit when in Budapest.
26;Great collection;If you are into paintings this is the place to be! Such a beatiful collection. We spend about 2.5 hours in the museum but could not see it all. The collection is nicely organized by style/country and period. Dont miss out on the great pieces by Cranach and Rafael.
26;Beautiful;Beautiful Egyptian and Greek collection underground in a beautiful building. The museum is beautifully arranged. There is a free cloakroom. Unfortunately, I didn't have the energy to see the rest of the museum but it seems to me that it would have been worth it. Overall, great experience. Free with the Budapest card.
26;very interesting;the building itself is very impressive. The collection is very interesting and worth a visit. the facilites are also excellent with a very clean and organised cloakroom and toilets. The bar and restaurant are very clearly marked for allergies and quality of food is excellent.
26;For art sake!;The museum is located adjacent to the Heroes Square and is a grand structure in its own right. We didn't have time to enjoy the exhibitions, but the building itself is a work of art.
26;RUDE STAFF;Men at entrance  VERY RUDE.  NO access to  Cafe or washrooms after spending over 100EUROs in the shop. Not helpful or even  polite.
26;My favorite art place in Budapest 🇭🇺;The Museum of Fine Arts Budapest is Hungary's largest and finest art museum. Its collection includes thousands of artwork from prehistory to the present. Old master paintings (13th to 18th centuries) was my favorite containing over 3000 paintings in the collection. If you enjoy art and paintings, make sure you allocate 3-5 hours to this museum. Felt that the Fine Arts Museum was above the Hungarian National Gallery in terms of display of art, more organized and the visit was more structured. This museum was my number 1 most enjoyed experience in Budapest. Entry price: 11EUR
26;Bosch exhibition;One of our main goals of visiting Budapest was the Bosch exhibition. It was an extra, that we could watch all exhibitions with the Bosch ticket, so we took the chance. It's a great building with lots to see, we seen hours here. Even the building itself worths a visit. There are many artifacts here from different eras of history. If someone likes arts they should certainly spend some time here.
26;Rude staff which do not speak English. Silly security rules.;The staff are all elderly and none speak English! Whether you bought a ticket online for a specific time is irrelevant to them, you have to queue anyway. If you have a bag it needs to be searched. After searching, it still needs to be deposited in the cloakroom. What is the point of that? If you get too close to the paintings, the staff give you a rude telling off in Hungarian, despite there being no signs stating in English how close you can get to the paintings.
26;Nice Visit;It’s a very good Art Museum - not great. If you like religious themes, you’ll love it as that seems to be the emphasis. We went for the Bosch exhibit which was also very good - not great. We walked here from the city center in about an hour. Kind of confusing to track rooms you’ve visited, but after a while, the art seemed all the same to me. Next to Heroes Plaza added to trip worthiness.
26;A first class art museum;A first class art museum. Great orientation for guests from abroad. Beautiful premises. The Bosch temporary exhibition was fabulous, with precious art and good documentation. The permanent collection has a few highlights that should not be missed. The panel describing these in the entry hall is worth consulting. As an advice - book tickets in advance to avoid the lines.
26;Badly Organised;Bought a ticket line for the Permanent Collection and had to wait 1 hour outside in the sun.<br>What’s the point of buying a ticket in advance when people who arrive after you without a ticket get in before you.<br>Once inside the art is fabulous, hardly anyone inside…they’re all queuing outside.<br>You should have 2 lines one for people with Hieronymus Bosch Tickets and one for people who have tickets for the permanent collection.<br>Won’t return.
27;Just go;Forget the negative comments in some other reviews, this is a first class museum. Very clear exhibits and well laid out that demonstrate the depth of history and culture of the region. So interesting, my wife and I spent two days there (about 10 hours in all) and still didn’t see it all in the detail we would have liked. We will go again next time we visit Budapest.
27;Disappointing;Get rid of all the staff. They are extremely rude and unhelpful. It felt like a work creation scheme. Lots of staff standing around chatting and ignoring the customers.
27;Chronological display of artefacts in need of coherent plain spoken narrative.;Needs a narrative, and a modern remake.  The items on permanent display quite good and well presented and labelled in Magyar and English.  However there’s very little historical narrative other than 500 to 1000 words for each half century or so in 20 sections.  They really need to update it with some modern museum expertise.  Otherwise it’s mostly set of artefacts laid out in chronological order.  It’s hard to find the permanent exhibit too amongst the temporary exhibits.  The narrative historical text in the great synagogue is much better.
27;Average;The museum staff was friendly but most of them hardly speak english language. Also at the ticket office the young man gave us the strange look when we wished to buy only tickets for the War is over! exhibition - they had lots of tickets for everything, too expensive for us to see all.
27;Great visit, well worth it;Fantastic museum would recommend a visit. Great range of exhibits with a lovely cafe and facilities.
27;A must!;It is a must to see activity while staying in Budapest. <br>The Coronation Mantle is just over the top. Also, when you see the Seuso Treasure you will be spechless. <br>There are also several interesting exhibitions. If you like history devote at least 1 hour for the Hungarian National Museum.
