poiID;title;text;
1;Sandor;Located adjacent to Buda Castle Complex, Sándor Palace has served as the official residence and workspace of the President of Hungary since 2003. If you can, try to time your visit for the hourly changing of the guards. From here, you can continue to explore the Buda Castle Complex and adjacent ruins.
1;Restored part of Castle Hill;The Changing of the Guard takes place in this area.<br><br>The top of Castle Hill was pounded to rubble during World War II and the buildings you see today are mid to late 20th century restorations.
1;President place;Here is a beautiful gate with attractive architecture!its near the President place.there are many beautiful views 😍😍
1;OK;Sandor Palace is the office of the President of Hungary. <br>The building looks nice but nothing much to do in here.
1;An elegant palace.;Nothing much to see or do here, other than watch the changing of the guard at this rather elegant palace.
1;Changing of the guard.;There really isn't much special about the palace. Actually looks like a big house. Nothing really grand about it. It was nice to see the changing of the guard though. Amazing how close you are to it all.
1;It was great to catch the change of the guard.;The palace is just a normal looking palace, nothing exceptional in contrast with the surroundings. What was really great is that we had a chance to watch the changing of the guard and this really made the visit here worthwhile.
1;Official residence of the President of Hungary from 2003. It is rarely open to the public.;Located on Castle Hill near to the top Funicular Station is this rather unassuming building that has been used as the official residence of the President of Hungary since 2003. The original building dated from 1806 and housed aristocrats and Prime Ministers. It was almost totally destroyed by bombing in WWII but was gradually rebuilt and renovated following Hungary's change to democracy in 1989.<br><br>The facade which faces the square and has two soldiers guarding its entrance, has two green doors above which sits the coat of arms of Hungary with the Hungarian and EU flags on either side.<br><br>Not a must see.
1;Sandor Palace;Sandor Palace is situated next to Buda Castle. It is where the Hungarian President lives and has 2 guards outside. The funicular is next to it. You cannot go inside.
1;Hungary’s Presidential Residence;The Sandor Palace is the official residence and headquarters of the president of Hungary. It was, as with all other buildings in Budapest, destroyed in the world war 2. Originally built in 1806 in the neoclassical style, Sandor Palace is housed inside Buda castle. You can see the guards change(not as lavish as the Buckingham places guards change in London, but I like the simplicity!) every hour up until 5pm with a little pomp of marching and drum rolls and rifle displays. <br><br>The views of neighbouring parliament and chain bridge as well as St Stephen’s Basilica are grand. There’s no entry fees to the castle unless you wish to visit the museums. If you have a bit of time hang around for the sunset as I must say the views are extraordinarily! <br><br>
1;we did see changing the guards;its a beautiful plain building<br>but we got a bonus when we was there<br>we watch the changing of the guards<br>very interesting<br>we could not visit it inside
1;Hungarian Presidential Palace next to Buda Castle;This is the residence of the President and is located at the top next to Buda Castle where the funicular is located.  You will see there are always military soldiers guarding the palace and you are welcome to take photographs, but you won't be able to get access inside the palace.<br><br>As a building on its own, it is interesting but not very eye-catching - though if you happen to see the official changing of the guards ceremony (which I didn't :(  sadly), then it is well worth it and probably deserves an extra star.  Here are the ceremony details:<br><br>*  Monday to Sunday: 9am – 5pm on the hour (eg 10am, 11am, etc).<br><br>*  Special Saturdays: once a month on the last Saturday of the month, the changing of the guards is accompanied by music. The Special Saturday Changing of the Guards is at 12pm.
2;The visitors feel cheated;We went to the library near National Museum on Saturday, 15 April 2023. The ticket cost 1700 forints and not the 1000 forints mentioned by others. None of the pictures we see on the net could be seen in any of the places. Large areas of the library were locked away. No one though we made it clear that we were here to see the images on the net, we were very quiet, but nobody guides us to any of those areas and we feel very cheated. <br>We are quiet sure we didn't miss them. Half the building was locked away and  we feel cheated because we paid quite a significant sum and we did not see any of the areas that the library talks about. <br><br>There were not even any signs up in English pointing to the historical nature of the building and how it has been built. That's up on the net but no details were there inside the building. this is a cheat on the tourists. Of course one must maintain the decorum of the library and we did. But the tourists should get to see what they paid for. The Municipality owes us an explanation on why we were cheated. We would like our money returned and we would like a proper visit where we get to see what we came to see.
2;Probably the most beautiful library in the world;I'm really pleased that I managed to visit this spectacular library. Finding the building was easy with Google map from Kalvin ter. The entrance is to the left of the building ( facing the front). As you enter, go through the double door to reach the actual foyer.  Go to the ladies sitting to the right where you can see the sign of Visa/MC for paying. It was 1800 HUF. The lady was not particularly welcoming but neither was she mean. I asked her for a tourist ticket, she asked me "the palace?" I said yes and paid. She even gave me a leaflet in English. <br>Go to the turnstiles where someone would lift the red rope to let you enter. Your ticket will not work at the turnstile. On the way out just push the bars to come out. Look for signs of the lift and go straight to 4th Floor. Come out of the lift, turn right, go through a white modern room and immediately you'll see the beautifully ornate rooms. It was slightly surreal to see young pupils working on their laptops under massive chandeliers. <br>Felt awkward to take photos but I guess students are used to tourists. Keep the camera silent. Visit all rooms. The room with staircase is really nice. The map identifies the rooms. There is some info on the original family as well. I suggest an hour to take it slowly. <br>You can have a drink at the cafe on the ground floor. <br>Probably the most beautiful library I have ever seen.
2;Beautiful reading rooms;Costs about £3 per person to enter, to look at the stunning reading rooms.  You obviously have to be super quiet and unobtrusive as people are still using the rooms for research and study.  Main negative was that the women at the front desk who sold us the tickets was very miserable and pretty rude, which was a shame.  The guy opening the gate to let you out again was nice though.
2;Impressive "royal reading rooms";The impressively decorated old palace rooms now serve as reading / study rooms for students. Each room is dedicated to another faculty. While the students quietly sit and study, we could wander through the rooms.
2;AMAZING hidden gem;I went with a tour group,  but it is available for individual visitors.  There is a small fee, but it is WELL worth it.  This is a beautiful building (palace) that has been transformed into a library - and a very popular one!!  The children's library is worth seeing, especially the dragon courtyard and the reading pit.  But the top floor is the most beautiful part.  You need to stay quiet, because these rooms are all used by university students to study in - but you can wander through the room gawking and taking photos.
2;WOW!;I was super excited to visit this library based on the photos I saw online.  However, once I got there I waited 10 mins outside before I got the courage to go in.  The reviews weren’t clear on access requirements and I didn’t want to be the stereotypical stupid American haha.<br><br>I entered via Reviczky u through 3 pairs of doors before you get to the information desk - wooden doors, glass sliding doors, wooden doors.  The lady at the desk spoke little English but she understood me enough to know why I was there.  The cost to enter is 1000 HUF, or approximately $3.31.  <br><br>Once you pay the fee, you have to go through security turnstiles.  Since I didn’t have a card, I had to ask a couple of ladies at the information desk (closest to the turnstiles) how to go in.  One of them took me through the red rope.  I think normally I would have had to deposit my things in the locker room but it was close to 7pm and they closed at 8pm. <br><br>Anyway, I quickly headed to the 4th floor soon after.  After stepping off the elevator, head to your left.  The old smoking room is in the very back. there are signs indicating “Palace”.  Before I got there, I passed the reading room which was breathtaking.  I actually sat in an alcove for 20 mins as I read about the history of the library.  Then I quietly headed to the old smoking room which is something out of a movie!  I sat in the room quietly as I looked around.<br><br>Honestly, the palace side of the 4th floor is enchanting.  I would have taken photos but I didn’t want to be a jerk since there were so many people studying.  I’m not even sure if photos are allowed.  <br><br>I poked around the first three floors but nothing else piqued my interest.  (With the entrance fee, I was limited to the first four floors.)<br><br>So grateful I got to see this beautiful library.
2;OK;Very pretty but all a bit odd really. It’s a library in a library but in the historical part there was lots of people studying which made it harder to appreciate
2;Wenckheim Palace Library ( Szabo Ervin Library );This not well advertised or locally known attractionI is well off the beaten track as far as tourists go. Never was it more evident, on asking for directions, that many of the Hungarian’s do not speak English. Reading signs on streets and maps leaves one quite exasperated. Persevere, this Budapest Metropolitan Library is a real wow. <br>A small fee 1000 HUF ($5.00 Aus) is charged to enable one to walk through the entrance, the First 3 floors equipped with thousands of books and readers. Floor 4 opens to this magnificent ( 1842-1912 ) Neo- Baroque building, three rooms all masterpieces, the Saloon and the Silver Boudoir, Small and Large Ballrooms, the Former dining room and Smoking room, now all reading rooms, so rich in ornamentation, in the style of Louis XV are the greatest unexpected wow of Budapest.
2;One of the nicest libraries I’ve seen;The interior of the fanciest part of the library remind me off the library from Beauty and the Beast. Purely beautiful. Worth spending 200huf on entry. Would definitely go there to read books if only I could read in hungerian haha
2;Simply put this is a 'must see' in Budapest;i was almost inclined to put a one-star to stop this place being flooded with visitors. There was only one other couple when we went and a few students studying (with their Apple Macs) in the grandiose rooms.<br><br>Clearly, the visit is not about the books nor the 'modern' part of the library but the staggeringly beautiful old library/palace. The rooms are simply amazing. Even palaces like Versailles and Blenheim would struggle to compare. OK i accept that this is a lot smaller but - wow - some amazing rooms. I struggle to comprehend just how they have survived thru all the turbulent years.<br><br>Yes it is a bit confusing on how to get in - and yes it cost 1,000HUF per adult (just under £3). But a bargain. Opens at 13h.<br><br>When 'signing-in' it was slightly amusing in that gave my name and there was a lot of punching stuff into a computer. We were then presented with three lovely tickets and a couple of photocopies in English. The lady then got up out of her seat and proceeded to guide us to the barriers and unleash a bit of chord and we were in. Almost could have done away with the tickets and all the typing. Once thru there was no indication on how to get to where the old library/palace was. A bit of hand-signal work indicated the 4th floor (by lift). Even when we came out of the lift it was not immediately evident - but we got there.<br><br>Seriously, I highly recommend.
3;Superb hotel in every way!;Wonderful hotel in heart of Budapest and right on the Clark bridge over the Danube.<br>From arrival to departure everything was superb! We had a room near the excellent spa where my husband swam every morning. The Kollazs brasserie was on point at every visit, be it Breakfast, dinner or cocktails around its great bar. Concierge arranged all our dinners and we enjoyed the great location to get around the city with ease.<br>In summary, if you are able to choose the Gresham palace as your stay in Budapest ….do it….it’s the best in town!
3;Fabulous hotel;Definitely worth it's 5* rating! A beautiful hotel in a great location, very easy to get to most of the key sights. Very attentive and friendly staff.
3;Quality hotel;Great location wonderful rooms wonderful art deco interiors.<br><br>This is a Four Seasons that feels like a Four Seasons. Still a large hotel but friendly and helpful.<br><br>Good location and will be even better once the bridge opp the front door is reconstructed and open again - rather a long way across to the Pest side.
3;Disappointing afternoon tea;Would not recommend afternoon tea. A lot of slights towards our table, unsure if this was on purpose, but I will give them the benefit of the doubt. Both teas came as loose leaf in the teapot, no strainer. Looked around and no one else seemed to have this issue. Also, the service was short and uninterested in coming to see to our needs. If we are less than the clientele they would like, that is fine, don't take us next time then.
3;All seasons?;The four seasons who have taken over this grand palatial place should be more welcoming of tourists all season. Especially, winter season.
3;The Palace;One is in awe when one visits Budapest. The architecture of  this Imperial city is so magnificent that I can't put enough word to describe it. A city built by the Habsburg dynasty and proclaimed it as their Imperial capital. The Austro-Hungarian Empire. And the Gresham Palace is one of those buidlings, and worth a visit.
3;Good setting with good views on Chain bridge;We enjoyed our lunch at the Lobby lounge of Four seasons Budapest. Good service and nice ambiance. Attentive staff. Special thanks to Lila<br>
3;Hotel;We popped in to have a look around. It's now a hotel. The building is grand and looks great. When we visited they still had all the christmas decorations on display which was great,
3;beautiful architecture;located near the st stephen square. it was formally an office but it now transformed into a 5star hotel. it has a beautiful architecture and intricate design.
3;Have coffee there;This former insurance office is now a 5 star hotel. To take in the grandeur we had a coffee in the elaborate foyer - great fun
3;Great stay at the Gresham Palace;Have just returned from a wonderful weekend in Budapest. Hotel was fabulous, rooms were gorgeous, staff went out of their way at every opportunity. Ate in the restaurant and had afternoon tea. Absolutely recommend. Oh, and the Christmas decorations were beautiful. Loved them.
3;A beautiful landmark.;The Gresham palace has always been and will forever be a classic and iconic landmark in Budapest, with a stunning location facing the famous Chain bridge.<br>The Christmas decorations inside the hotel's lobby were just lovely.
4;Beautiful Views;Very beautiful castle with amazing views over looking the Danube and Pest. The inner courtyard is great and plenty of information signs with details on the castle.
4;Szent István Hall is beautiful!;Visited the Szent István Hall and Budapest History Museum in Buda Castle (Budavári Palace) in early March 2023. Great place for a visitor to learn facts about the history of Budapest. Szent István Hall is beautiful. Amazing craftsmanship. Some parts of the Buda Castle complex were under construction during my visit. A tablet digital tour (with audio guide) for Szent István Hall is included in the ticket price.  A must-do activity.
4;March last year we went up in cable car. There was a wine tasting festival on the top of the castle and we paid nearly equivalen;My partner and I spent hours walking around buda castle the views from the top across the Danube River are unbelievable as far as the eye can see<br>The architecture is some of the  most beautiful I have seen  on my travels <br>I have been to quiet a few country's over the years <br>As has my partner and we love  the  buda castle <br>Very spacious to walk about at the top and great for taking pictures to add to your collection <br>There is a great service with buda castle like bus thingys at the bottom on the road if someone struggles to walk up the pretty steep  walk ways <br>You can also get the fenicelor cable car up to the top
4;One more Castle;A huge place in Budapeste with a wonderful view.<br>Near the castle you can also visit the Hospital in the Rock, a place that help people in the 2nd World War.
4;Confusing entry time;We bought tickets for the museum and castle at the ticket office, given an entry time at 1400, so waited an hour in the cafe, then entered the museum at 1400. Once walked round the museum went to enter the castle and was rudely told entry at 1400. No flexibility. At no point we're we told about this. We just gave up. Waste of time and money. I have found in this city that it is a tally a waste of time visiting the official sites especially with teenage kids there is zero flexibility. Just look at the site from the outside and eat nice food don't waste your life with this.
4;Breathes history;The Budapest Castle was the highlight of our trip in Budapest. The castle towers over the entire city, and from its extensive gardens and courtyards, you can experience wonderful views of the city skyline. You can get to the castle on foot, by public transport or by the historic cable car, which is an attraction for tourists. There are several museums within the entire area of the castle, we chose one of them, which offers a cross-section of the history of the castle itself but also of the entire city. The museum itself was nothing special, but there are many exhibits and the price is very reasonable. If you decide not to visit some of the museums, be sure to at least visit the courtyards and gardens, which offer unforgettable scenery.
4;Lovely view;Beautiful castle and a must visit for Budapest! We went into the museum but I wouldn’t say this is necessary, didn’t have much of interest for us personally. But still definitely visit the castle and the grounds as beautiful!!
4;Extremely Interesting Tourist Attraction;We thoroughly enjoyed our visit here. We took our time and walked around all the grounds - there’s so much more than just the front of the palace, and all the information boards were very useful. The architecture and improvements were interesting. We visited on a Sunday morning and it wasn’t too crowded. We’d walked through on the Saturday afternoon the day before and it was very busy so we were glad to return and take our time the following morning. The Gallery was peaceful and well laid out. The visiting  exhibition was also very good. The icing on the cake was the choir singing when we arrived and the acoustics were amazing.
4;Buda site;It was a very good experience at the buda site we recommend to visit.<br>And try to go with bicycle 🚲 . And have a tour in Buda city
4;Kind of overwhelming;I wasn’t impressed honestly. A little underwhelming, a lot of people, wasn’t even a very ornate building. There was some construction work/maintenance going on that might have spoiled the experience.
4;Beautiful view;It is classified as a World Heritage Site. <br>We spent a lot of time here, including in the museum. <br>Castle offers amazing views. <br>There are a number of restaurants and bars. <br>This must-see site in Budapest is situated in the Buda neighborhood. Tourists are more inclined to visit The Pest.
4;Pleasant castle visit;Wandered around castle grounds after leaving our hotel. Signage to museum entry was very poor (especially as it was wet). Eventually followed others into building through a large door. <br>Had not booked online and thus not sure of gaining entrance, however on asking and providing proof of age we were admitted free as over 70.<br>Several staterooms to see and auxiliary exhibitions. Lots of information to read about the old monarchy and also about the architects.<br>Quite a lot of construction going on in the grounds and did not visit the art galleries as of little interest.<br>Some beautiful views across the city and especially the parliament building. Looks magnificent in sunshine and when illuminated at night.
5;Loved it so much;I loved it, booked on the 3pm tour at the desk by just walking in 15 mins beforehand - ticket offices are teeny tiny windows in the far corners either side of main entrance. Toilets are only accessible on the tour, and there’s a little performance on the stairwell at the end for all groups so find a spot and don’t move or you’ll lose it as they fill up fast. Your tour guide will have a paddle with the flag of your chosen tour language on it, but sometimes there are private tours also with a language paddle, so check with guide. They don’t all set off at the same time, to allow for being able to hear your guide. Lots of opportunity for pictures, friendly and knowledgeable guide
5;Lovely;5out of 5 the architecture is marvellous although it is not that big but it is a must see when you visit budapest <br>Seen a play there
5;Opera;This was extremely stress relieving for whatever reason I always loved the Opera but I currently believe this might be the best place to hear Opera
5;Nice opera;Amazing! We did a one hour tour with a 10 minutes concert and we had a great time, the opera is in really nice condition. Beautiful outside and inside
5;A gorgeous building - wow!;We came here for our first ever visit to the Opera, Carmen. The building is gorgeous, having been subject to five years' refurbishment, only reopening just over a year ago.  The place sparkles, it is gorgeous.<br>There are clever devices in the arms of the seats, pull out tablets, on which one can see subtitles in a range of languages.  I found this really helpful.  I had read up on the storyline in advance, and was familiar with some of the music, but having the words was really helpful to my attempts at following the plot.<br>Sadly for us, most of the action was towards the left side of the stage, below our seats, so our limited view was very limited, not helped by those to our left leaning far forward onto the rail in front.  There are screens, but from where we were sitting they were too low and too small.  <br>The building itself was very warm - I had been concerned it might be cold, and it was in fact almost too warm!<br>As ever, there was a lengthy queue for the ladies in the interval, such that I didn't have time to drink my wine before we had to return to our seats.<br>Regardless of anything else, a visit to the Opera House is certainly to be recommended, it is truly gorgeous.
5;messiah : great piece the Handels Messiah;Loved our seats 1 and 2 so that we could watch the Musicans and the best was the director to see how he lead his performers with compassion and love to the exact moment. <br>It was a great piece of music!
5;Wonderful ballet performance in a stunning venue;We attended this magnificent building on Saturday 7 January to see the National Hungarian Ballet performance of The Nutcracker. The whole experience was amazing.<br>We were blown away by the ballet: the performance, the dancing, stage set, costumes, huge talented cast,  the junior and younger ballet associates, the orchestra…we have seen many other national ballet performances around the world (including The Nutcracker) and this performance clearly topped them all. It was fabulous.<br>The Opera House is stunning. This added another level to what we experienced. As English speakers, we found signage of where to go difficult to follow, but the staff were friendly and helpful. The arrangement of seating in the boxes gave the audience a fantastic view of the stage, and acoustics were great.<br>Highly recommend attending a performance here….and especially a ballet!
5;Spectacular structure!;Incredible building with ornate Baroque features.  Built in the 1800s, it has capacity for 2,500 opera fans.
5;Beautiful opera and great tour;Beautiful opera and the english tour was super interesting. Thankfully they split the tour because the groups are really large. Definitely something not to miss when in Budapest.
5;Splendor - magical performance of the Nutcracker;Wanted to see a ballet or opera here and when I was in Hungary the Nutcracker was playing. The whole experience was fantastic. Entering the building, the cloakroom staff, seeing the stage, orchestra pit ..... Then the performance started at it was just magical. <br>If I had my time again the only thing that I would change, would be that I would get tickets in the stalls. We were in the first row of the Royal Circle. It is quite high up because there are many boxes  beneath.
